repository_name,full_name,owner,description,language,stars,forks,watchers,open_issues,size_kb,default_branch,created_at,updated_at,license,topics,visibility,has_issues,has_projects,has_wiki,has_pages,archived,disabled
build-your-own-x,codecrafters-io/build-your-own-x,codecrafters-io,Master programming by recreating your favorite technologies from scratch.,Markdown,521744,49367,521744,515,1100,master,2018-05-09T12:03:18Z,2026-07-02T14:27:38Z,,"awesome-list, free, programming, tutorial-code, tutorial-exercises, tutorials",public,True,False,False,False,False,False
awesome,sindresorhus/awesome,sindresorhus,😎 Awesome lists about all kinds of interesting topics,,480790,35646,480790,88,1565,main,2014-07-11T13:42:37Z,2026-07-02T14:30:31Z,Creative Commons Zero v1.0 Universal,"awesome, awesome-list, lists, resources, unicorns",public,True,False,False,True,False,False
freeCodeCamp,freeCodeCamp/freeCodeCamp,freeCodeCamp,"freeCodeCamp.org's open-source codebase and curriculum. Learn math, programming, and computer science for free.",TypeScript,450845,45334,450845,205,577580,main,2014-12-24T17:49:19Z,2026-07-02T14:29:10Z,"BSD 3-Clause ""New"" or ""Revised"" License","careers, certification, community, curriculum, d3, education, freecodecamp, javascript, learn-to-code, math, nodejs, nonprofits, programming, react, teachers",public,True,True,False,False,False,False
public-apis,public-apis/public-apis,public-apis,A collective list of free APIs,Python,446001,48948,446001,1480,6864,master,2016-03-20T23:49:42Z,2026-07-02T14:29:23Z,MIT License,"api, apis, dataset, development, free, list, lists, open-source, public, public-api, public-apis, resources, software",public,True,False,False,False,False,False
free-programming-books,EbookFoundation/free-programming-books,EbookFoundation,:books: Freely available programming books,Python,391129,66468,391129,76,21499,main,2013-10-11T06:50:37Z,2026-07-02T14:25:10Z,Creative Commons Attribution 4.0 International,"books, education, hacktoberfest, list, resource",public,True,False,False,True,False,False
openclaw,openclaw/openclaw,openclaw,Your own personal AI assistant. Any OS. Any Platform. The lobster way. 🦞 ,TypeScript,381435,79942,381435,6858,1627601,main,2025-11-24T10:16:47Z,2026-07-02T14:30:26Z,Other,"ai, assistant, crustacean, molty, openclaw, own-your-data, personal",public,True,False,False,False,False,False
developer-roadmap,nilbuild/developer-roadmap,nilbuild,"Interactive roadmaps, guides and other educational content to help developers grow in their careers.",TypeScript,358937,44322,358937,25,361404,master,2017-03-15T13:45:52Z,2026-07-02T14:25:18Z,Other,"angular-roadmap, backend-roadmap, blockchain-roadmap, computer-science, dba-roadmap, developer-roadmap, devops-roadmap, frontend-roadmap, go-roadmap, java-roadmap, javascript-roadmap, nodejs-roadmap, python-roadmap, qa-roadmap, react-roadmap, roadmap, software-architect-roadmap, vue-roadmap",public,True,False,True,False,False,False
system-design-primer,donnemartin/system-design-primer,donnemartin,Learn how to design large-scale systems. Prep for the system design interview.  Includes Anki flashcards.,Python,355810,56994,355810,566,11277,master,2017-02-26T16:15:28Z,2026-07-02T14:25:11Z,Other,"design, design-patterns, design-system, development, interview, interview-practice, interview-questions, programming, python, system, web, web-application, webapp",public,True,True,True,False,False,False
coding-interview-university,jwasham/coding-interview-university,jwasham,A complete computer science study plan to become a software engineer.,,354841,84044,354841,120,22700,main,2016-06-06T02:34:12Z,2026-07-02T14:28:51Z,Creative Commons Attribution Share Alike 4.0 International,"algorithm, algorithms, coding-interview, coding-interviews, computer-science, data-structures, interview, interview-prep, interview-preparation, programming-interviews, software-engineering, study-plan",public,True,False,False,False,False,False
awesome-python,vinta/awesome-python,vinta,"An opinionated list of Python frameworks, libraries, tools, and resources",Python,305953,28201,305953,20,5712,master,2014-06-27T21:00:06Z,2026-07-02T14:29:02Z,Other,"awesome, collections, python, python-frameworks, python-libraries, python-tools",public,False,False,False,True,False,False
awesome-selfhosted,awesome-selfhosted/awesome-selfhosted,awesome-selfhosted,A list of Free Software network services and web applications which can be hosted on your own servers,,302354,14088,302354,0,16867,master,2015-06-01T02:33:17Z,2026-07-02T14:30:34Z,Other,"awesome, awesome-list, cloud, free-software, hosting, privacy, self-hosted, selfhosted",public,False,False,False,False,False,False
996.ICU,996icu/996.ICU,996icu,Repo for counting stars and contributing. Press F to pay respect to glorious developers.,,276350,20810,276350,16697,189351,master,2019-03-26T07:31:14Z,2026-07-02T13:00:13Z,Other,,public,False,False,False,False,False,False
project-based-learning,practical-tutorials/project-based-learning,practical-tutorials,Curated list of project-based tutorials,,271808,35105,271808,321,438,master,2017-04-12T05:07:46Z,2026-07-02T14:28:43Z,MIT License,"beginner-project, cpp, golang, javascript, project, python, tutorial, webdevelopment",public,True,True,True,False,False,False
react,react/react,react,The library for web and native user interfaces.,JavaScript,246166,51135,246166,1254,1008269,main,2013-05-24T16:15:54Z,2026-07-02T14:12:45Z,MIT License,"declarative, frontend, javascript, library, react, ui",public,True,False,False,True,False,False
superpowers,obra/superpowers,obra,An agentic skills framework & software development methodology that works.,Shell,244084,21666,244084,300,3647,main,2025-10-09T19:45:18Z,2026-07-02T14:30:10Z,MIT License,"ai, brainstorming, coding, obra, sdlc, skills, subagent-driven-development, superpowers",public,True,True,True,False,False,False
linux,torvalds/linux,torvalds,Linux kernel source tree,C,238006,62987,238006,3,6313175,master,2011-09-04T22:48:12Z,2026-07-02T13:58:49Z,Other,,public,False,True,False,False,False,False
the-book-of-secret-knowledge,trimstray/the-book-of-secret-knowledge,trimstray,"A collection of inspiring lists, manuals, cheatsheets, blogs, hacks, one-liners, cli/web tools and more.",,231270,13821,231270,157,1748,master,2018-06-23T10:43:14Z,2026-07-02T14:30:33Z,MIT License,"awesome, awesome-list, bsd, cheatsheets, devops, guidelines, hacking, hacks, howtos, linux, lists, manuals, one-liners, pentesters, resources, search-engines, security, security-researchers, sysops",public,False,False,False,False,False,False
ECC,affaan-m/ECC,affaan-m,"The agent harness performance optimization system. Skills, instincts, memory, security, and research-first development for Claude Code, Codex, Opencode, Cursor and beyond.",JavaScript,224943,34431,224943,87,38336,main,2026-01-18T00:51:51Z,2026-07-02T14:28:22Z,MIT License,"ai-agents, anthropic, claude, claude-code, developer-tools, llm, mcp, productivity",public,True,True,True,False,False,False
Python,TheAlgorithms/Python,TheAlgorithms,All Algorithms implemented in Python,Python,222375,50811,222375,996,16572,master,2016-07-16T09:44:01Z,2026-07-02T14:24:07Z,MIT License,"algorithm, algorithm-competitions, algorithms-implemented, algos, community-driven, education, hacktoberfest, interview, learn, practice, python, searches, sorting-algorithms, sorts",public,True,True,True,True,False,False
vue,vuejs/vue,vuejs,"This is the repo for Vue 2. For Vue 3, go to https://github.com/vuejs/core",TypeScript,209938,33720,209938,635,32152,main,2013-07-29T03:24:51Z,2026-07-02T14:26:30Z,MIT License,"framework, frontend, javascript, vue",public,True,True,True,False,False,False
hermes-agent,NousResearch/hermes-agent,NousResearch,The agent that grows with you,Python,207786,37745,207786,24910,453443,main,2025-07-22T22:22:28Z,2026-07-02T14:30:00Z,MIT License,"ai, ai-agent, ai-agents, anthropic, chatgpt, claude, claude-code, clawdbot, codex, hermes, hermes-agent, llm, moltbot, nous-research, openai, openclaw",public,True,True,True,True,False,False
computer-science,ossu/computer-science,ossu,🎓 Path to a free self-taught education in Computer Science!,HTML,205581,25532,205581,23,1784,master,2014-05-04T00:18:39Z,2026-07-02T14:25:49Z,MIT License,"awesome-list, computer-science, courses, curriculum",public,True,True,True,True,False,False
javascript-algorithms,trekhleb/javascript-algorithms,trekhleb,📝 Algorithms and data structures implemented in JavaScript with explanations and links to further readings,JavaScript,196169,31048,196169,400,14956,master,2018-03-24T07:47:04Z,2026-07-02T14:10:02Z,MIT License,"algorithm, algorithms, computer-science, data-structures, interview, interview-preparation, javascript, javascript-algorithms",public,True,False,False,False,False,False
tensorflow,tensorflow/tensorflow,tensorflow,An Open Source Machine Learning Framework for Everyone,C++,195905,75252,195905,2645,1340620,master,2015-11-07T01:19:20Z,2026-07-02T14:29:03Z,Apache License 2.0,"deep-learning, deep-neural-networks, distributed, machine-learning, ml, neural-network, python, tensorflow",public,True,True,False,False,False,False
n8n,n8n-io/n8n,n8n-io,"Fair-code workflow automation platform with native AI capabilities. Combine visual building with custom code, self-host or cloud, 400+ integrations.",TypeScript,194894,59001,194894,1436,515431,master,2019-06-22T09:24:21Z,2026-07-02T14:30:21Z,Other,"ai, apis, automation, cli, data-flow, development, integration-framework, integrations, ipaas, low-code, low-code-platform, mcp, mcp-client, mcp-server, n8n, no-code, self-hosted, typescript, workflow, workflow-automation",public,True,False,False,True,False,False
claw-code,ultraworkers/claw-code,ultraworkers,"An agent-managed museum exhibit, built in Rust with Gajae-Code / LazyCodex — developed and maintained with no human intervention.",Rust,194510,109856,194510,22,25104,main,2026-03-31T08:58:08Z,2026-07-02T14:19:48Z,MIT License,,public,True,True,False,False,False,False
ohmyzsh,ohmyzsh/ohmyzsh,ohmyzsh,"🙃   A delightful community-driven (with 2,500+ contributors) framework for managing your zsh configuration. Includes 300+ optional plugins (rails, git, macOS, hub, docker, homebrew, node, php, python, etc), 140+ themes to spice up your morning, and an auto-update tool that makes it easy to keep up with the latest updates from the community.",Shell,188257,26373,188257,568,13648,master,2009-08-28T18:15:37Z,2026-07-02T14:12:45Z,MIT License,"cli, cli-app, oh-my-zsh, oh-my-zsh-plugin, oh-my-zsh-theme, ohmyzsh, plugin-framework, plugins, productivity, shell, terminal, theme, themes, zsh, zsh-configuration",public,True,True,True,False,False,False
vscode,microsoft/vscode,microsoft,Visual Studio Code,TypeScript,186908,40798,186908,18934,1308957,main,2015-09-03T20:23:38Z,2026-07-02T14:29:00Z,MIT License,"editor, electron, microsoft, typescript, visual-studio-code",public,True,True,True,False,False,False
andrej-karpathy-skills,multica-ai/andrej-karpathy-skills,multica-ai,"A single CLAUDE.md file to improve Claude Code behavior, derived from Andrej Karpathy's observations on LLM coding pitfalls.",,186513,19133,186513,121,20,main,2026-01-27T03:53:13Z,2026-07-02T14:29:40Z,,,public,False,True,True,False,False,False
AutoGPT,Significant-Gravitas/AutoGPT,Significant-Gravitas,"AutoGPT is the vision of accessible AI for everyone, to use and to build on. Our mission is to provide the tools, so that you can focus on what matters.",Python,185262,46115,185262,458,625013,master,2023-03-16T09:21:07Z,2026-07-02T13:56:29Z,Other,"agentic-ai, agents, ai, artificial-intelligence, autonomous-agents, claude, gpt, llama-api, llm, openai, python",public,True,True,True,False,False,False
CS-Notes,CyC2018/CS-Notes,CyC2018,:books: 技术面试必备基础知识、Leetcode、计算机操作系统、计算机网络、系统设计,,184661,50870,184661,196,116179,master,2018-02-13T14:56:24Z,2026-07-02T13:00:45Z,,"algorithm, computer-science, cpp, interview, java, leetcode, python, system-design",public,True,True,True,True,False,False
You-Dont-Know-JS,getify/You-Dont-Know-JS,getify,A book series (2 published editions) on the JS language.,,184554,33501,184554,2,15241,2nd-ed,2013-11-16T02:37:24Z,2026-07-02T14:06:41Z,Other,"async, book, book-series, closures, education, es2015, es6, javascript, learn-to-code, programming, prototypes, training-materials, training-providers",public,True,True,False,False,False,False
Python-100-Days,jackfrued/Python-100-Days,jackfrued,Python - 100天从新手到大师,Jupyter Notebook,183861,55681,183861,701,401142,master,2018-03-01T16:05:52Z,2026-07-02T13:37:39Z,,,public,True,True,True,False,False,False
FreeDomain,DigitalPlatDev/FreeDomain,DigitalPlatDev,DigitalPlat FreeDomain: Free Domain For Everyone,HTML,182180,3741,182180,34,972,main,2024-05-30T13:23:00Z,2026-07-02T14:25:43Z,GNU Affero General Public License v3.0,"digitalplat, domain, domain-platform, domainname, domains, free, freedomain",public,False,True,True,False,False,False
opencode,anomalyco/opencode,anomalyco,The open source coding agent.,TypeScript,181621,22425,181621,7160,314773,dev,2025-04-30T20:08:00Z,2026-07-02T14:28:41Z,MIT License,,public,True,True,False,False,False,False
Microsoft-Activation-Scripts,massgravel/Microsoft-Activation-Scripts,massgravel,"Open-source Windows and Office activator featuring HWID, Ohook, TSforge, and Online KMS activation methods, along with advanced troubleshooting.",Batchfile,181569,17412,181569,4,12997,master,2020-01-12T23:03:34Z,2026-07-02T14:22:45Z,GNU General Public License v3.0,"activator, hwid, kms, kms38, massgrave, massgravel, microsoft, microsoft365, office, office365, ohook, powershell, tsforge, windows, windows-10, windows-11",public,True,False,False,False,False,False
flutter,flutter/flutter,flutter,Flutter makes it easy and fast to build beautiful apps for mobile and beyond,Dart,177528,30586,177528,12889,451509,master,2015-03-06T22:54:58Z,2026-07-02T14:28:56Z,"BSD 3-Clause ""New"" or ""Revised"" License","android, app-framework, cross-platform, dart, dart-platform, desktop, flutter, flutter-package, fuchsia, ios, linux-desktop, macos, material-design, mobile, mobile-development, skia, web, web-framework, windows",public,True,True,True,False,False,False
awesome-go,avelino/awesome-go,avelino,"A curated list of awesome Go frameworks, libraries and software",Go,176942,13372,176942,185,11911,main,2014-07-06T13:42:15Z,2026-07-02T14:17:32Z,MIT License,"awesome, awesome-list, go, golang, golang-library, hacktoberfest",public,True,False,False,True,False,False
ollama,ollama/ollama,ollama,"Get up and running with Kimi-K2.6, GLM-5.1, MiniMax, DeepSeek, gpt-oss, Qwen, Gemma and other models.",Go,175295,16798,175295,3498,89422,main,2023-06-26T19:39:32Z,2026-07-02T14:08:50Z,MIT License,"deepseek, gemma, gemma3, glm, go, golang, gpt-oss, llama, llama3, llm, llms, minimax, mistral, ollama, qwen",public,True,False,False,False,False,False
yt-dlp,yt-dlp/yt-dlp,yt-dlp,A feature-rich command-line audio/video downloader,Python,174699,14753,174699,2509,61248,master,2020-10-26T04:22:55Z,2026-07-02T14:26:32Z,The Unlicense,"cli, downloader, python, sponsorblock, youtube-dl, youtube-downloader, yt-dlp",public,True,True,True,False,False,False
gitignore,github/gitignore,github,A collection of useful .gitignore templates,,174687,82373,174687,72,3137,main,2010-11-08T20:17:14Z,2026-07-02T14:08:35Z,Creative Commons Zero v1.0 Universal,"git, gitignore",public,False,False,False,False,False,False
bootstrap,twbs/bootstrap,twbs,"The most popular HTML, CSS, and JavaScript framework for developing responsive, mobile first projects on the web.",MDX,174415,78763,174415,266,301046,main,2011-07-29T21:19:00Z,2026-07-02T13:24:08Z,MIT License,"bootstrap, css, css-framework, html, javascript, sass, scss",public,True,True,False,True,False,False
prompts.chat,f/prompts.chat,f,"f.k.a. Awesome ChatGPT Prompts. Share, discover, and collect prompts from the community. Free and open source — self-host for your organization with complete privacy.",HTML,164634,21301,164634,58,424676,main,2022-12-05T13:54:13Z,2026-07-02T14:06:20Z,Other,"ai, artificial-intelligence, awesome-list, chatgpt, chatgpt-prompts, claude, gemini, gpt, gpt-4, llm, machine-learning, nextjs, open-source, openai, prompt-engineering, prompts, prompts-chat, typescript",public,True,True,True,True,False,False
stable-diffusion-webui,AUTOMATIC1111/stable-diffusion-webui,AUTOMATIC1111,Stable Diffusion web UI,Python,163898,30372,163898,2493,36552,master,2022-08-22T14:05:26Z,2026-07-02T14:27:33Z,GNU Affero General Public License v3.0,"ai, ai-art, deep-learning, diffusion, gradio, image-generation, image2image, img2img, pytorch, stable-diffusion, text2image, torch, txt2img, unstable, upscaling, web",public,True,True,True,False,False,False
HelloGitHub,521xueweihan/HelloGitHub,521xueweihan,":octocat: 分享 GitHub 上有趣、入门级的开源项目。Share interesting, entry-level open source projects on GitHub.",Python,163650,12269,163650,476,9207,master,2016-05-04T06:24:11Z,2026-07-02T14:17:53Z,,"awesome, github, hellogithub, python",public,True,True,False,False,False,False
markitdown,microsoft/markitdown,microsoft,Python tool for converting files and office documents to Markdown.,Python,162341,11458,162341,824,4286,main,2024-11-13T19:56:40Z,2026-07-02T14:30:02Z,MIT License,"autogen, autogen-extension, langchain, markdown, microsoft-office, openai, pdf",public,True,True,True,False,False,False
transformers,huggingface/transformers,huggingface,"🤗 Transformers: the model-definition framework for state-of-the-art machine learning models in text, vision, audio, and multimodal models, for both inference and training. ",Python,162130,33723,162130,2458,518244,main,2018-10-29T13:56:00Z,2026-07-02T14:20:50Z,Apache License 2.0,"audio, deep-learning, deepseek, gemma, glm, hacktoberfest, llm, machine-learning, model-hub, natural-language-processing, nlp, pretrained-models, python, pytorch, pytorch-transformers, qwen, speech-recognition, transformer, vlm",public,True,True,True,False,False,False
the-art-of-command-line,jlevy/the-art-of-command-line,jlevy,"Master the command line, in one page",,161481,14826,161481,256,2772,master,2015-05-20T15:11:03Z,2026-07-02T14:06:32Z,,"bash, documentation, linux, macos, unix, windows",public,True,True,False,False,False,False
skills,anthropics/skills,anthropics,Public repository for Agent Skills,Python,157601,18569,157601,992,4030,main,2025-09-22T15:53:31Z,2026-07-02T14:24:35Z,,agent-skills,public,True,False,False,False,False,False
JavaGuide,Snailclimb/JavaGuide,Snailclimb,Java 面试 & 后端通用面试指南，覆盖计算机基础、数据库、分布式、高并发、系统设计与 AI 应用开发,JavaScript,156754,46159,156754,58,183376,main,2018-05-07T13:27:00Z,2026-07-02T14:25:55Z,Apache License 2.0,"agent, ai, context-engineering, deepseek, interview, java, mcp, mysql, redis, redisson, skills, springai, system-design",public,True,True,True,False,False,False
skills,mattpocock/skills,mattpocock,Skills for Real Engineers. Straight from my .claude directory.,Shell,153998,13280,153998,105,525,main,2026-02-03T11:15:53Z,2026-07-02T14:29:13Z,MIT License,,public,True,True,False,False,False,False
langflow,langflow-ai/langflow,langflow-ai,Langflow is a powerful tool for building and deploying AI-powered agents and workflows.,Python,150482,9386,150482,974,1394856,main,2023-02-08T22:28:03Z,2026-07-02T14:30:09Z,MIT License,"agents, chatgpt, generative-ai, large-language-models, multiagent, react-flow",public,True,True,True,True,False,False
javascript,airbnb/javascript,airbnb,JavaScript Style Guide,JavaScript,148088,26650,148088,159,3738,master,2012-11-01T23:13:50Z,2026-07-02T14:03:03Z,MIT License,"arrow-functions, es2015, es2016, es2017, es2018, es6, eslint, javascript, linting, naming-conventions, style-guide, style-linter, styleguide, tc39",public,True,False,True,True,False,False
dify,langgenius/dify,langgenius,Production-ready platform for agentic workflow development.,TypeScript,147395,23206,147395,864,410492,main,2023-04-12T07:40:24Z,2026-07-02T14:10:29Z,Other,"agent, agentic-ai, agentic-framework, agentic-workflow, ai, automation, gemini, genai, gpt, gpt-4, llm, low-code, mcp, nextjs, no-code, openai, orchestration, python, rag, workflow",public,True,False,False,False,False,False
scrcpy,Genymobile/scrcpy,Genymobile,Display and control your Android device,C,144898,13368,144898,2847,8707,master,2017-11-21T18:00:27Z,2026-07-02T13:50:52Z,Apache License 2.0,"android, c, ffmpeg, libav, mirroring, recording, screen, sdl2",public,True,False,True,False,False,False
open-webui,open-webui/open-webui,open-webui,"User-friendly AI Interface (Supports Ollama, OpenAI API, ...)",Python,143816,20762,143816,264,384111,main,2023-10-06T22:08:27Z,2026-07-02T14:21:26Z,Other,"ai, llm, llm-ui, llm-webui, llms, mcp, ollama, ollama-webui, open-webui, openai, openapi, rag, self-hosted, ui, webui",public,True,False,True,False,False,False
firecrawl,firecrawl/firecrawl,firecrawl,"The API to search, scrape, and interact with the web at scale. 🔥",TypeScript,143074,8244,143074,384,94512,main,2024-04-15T21:02:29Z,2026-07-02T14:28:25Z,GNU Affero General Public License v3.0,"ai, ai-agents, ai-crawler, ai-scraping, ai-search, crawler, data-extraction, html-to-markdown, llm, markdown, scraper, scraping, web-crawler, web-data, web-data-extraction, web-scraper, web-scraping, web-search, webscraping",public,True,True,False,False,False,False
system-prompts-and-models-of-ai-tools,x1xhlol/system-prompts-and-models-of-ai-tools,x1xhlol,"FULL Augment Code, Claude Code, Cluely, CodeBuddy, Comet, Cursor, Devin AI, Junie, Kiro, Leap.new, Lovable, Manus, NotionAI, Orchids.app, Perplexity, Poke, Qoder, Replit, Same.dev, Trae, Traycer AI, VSCode Agent, Warp.dev, Windsurf, Xcode, Z.ai Code, Dia & v0. (And other Open Sourced) System Prompts, Internal Tools & AI Models",,141431,34766,141431,154,1428,main,2025-03-05T16:38:29Z,2026-07-02T14:30:02Z,GNU General Public License v3.0,"ai, bolt, cluely, copilot, cursor, cursorai, devin, github-copilot, lovable, open-source, perplexity, replit, system-prompts, trae, trae-ai, trae-ide, v0, vscode, windsurf, windsurf-ai",public,True,True,True,False,False,False
langchain,langchain-ai/langchain,langchain-ai,The agent engineering platform.,Python,140745,23369,140745,416,582202,master,2022-10-17T02:58:36Z,2026-07-02T14:26:34Z,MIT License,"agents, ai, ai-agents, anthropic, chatgpt, deepagents, enterprise, framework, gemini, generative-ai, langchain, langgraph, llm, multiagent, open-source, openai, pydantic, python, rag, typescript",public,True,False,False,False,False,False
youtube-dl,ytdl-org/youtube-dl,ytdl-org,Command-line program to download videos from YouTube.com and other video sites,Python,140626,10679,140626,4128,65510,master,2010-10-31T14:35:07Z,2026-07-02T12:54:53Z,The Unlicense,,public,True,True,False,True,False,False
tech-interview-handbook,yangshun/tech-interview-handbook,yangshun,Curated coding interview preparation materials for busy software engineers,TypeScript,140580,16650,140580,46,33749,main,2016-07-05T05:00:48Z,2026-07-02T14:24:45Z,MIT License,"algorithm, algorithm-interview, algorithm-interview-questions, algorithms, behavioral-interviews, coding-interviews, interview-practice, interview-preparation, interview-questions, system-design",public,True,False,True,False,False,False
next.js,vercel/next.js,vercel,The React Framework,JavaScript,140235,31296,140235,4145,2500582,canary,2016-10-05T23:32:51Z,2026-07-02T14:28:43Z,MIT License,"blog, browser, compiler, components, hybrid, nextjs, node, react, server-rendering, ssg, static, static-site-generator, universal, vercel",public,True,False,False,False,False,False
PowerToys,microsoft/PowerToys,microsoft,Microsoft PowerToys is a collection of utilities that supercharge productivity and customization on Windows,C,135916,8181,135916,7339,510227,main,2019-05-01T17:44:02Z,2026-07-02T14:09:29Z,MIT License,"advanced-paste, color-picker, command-palette, desktop, fancyzones, keyboard-manager, microsoft-powertoys, powerrename, powertoys, windows, windows-10, windows-11",public,True,True,True,True,False,False
claude-code,anthropics/claude-code,anthropics,"Claude Code is an agentic coding tool that lives in your terminal, understands your codebase, and helps you code faster by executing routine tasks, explaining complex code, and handling git workflows - all through natural language commands.",Python,135452,21830,135452,9575,28682,main,2025-02-22T17:41:21Z,2026-07-02T14:29:07Z,,,public,True,False,False,False,False,False
go,golang/go,golang,The Go programming language,Go,134919,19060,134919,10168,443702,master,2014-08-19T04:33:40Z,2026-07-02T14:29:13Z,"BSD 3-Clause ""New"" or ""Revised"" License","go, golang, language, programming-language",public,True,True,True,False,False,False
fucking-algorithm,labuladong/fucking-algorithm,labuladong,"Crack LeetCode, not only how, but also why. ",Markdown,134652,23618,134652,3,126234,master,2020-02-19T09:01:23Z,2026-07-02T13:41:23Z,,"algorithms, computer-science, data-structures, dynamic-programming, dynamic-programming-algorithm, interview-questions, kmp, leetcode",public,True,False,False,False,False,False
iptv,iptv-org/iptv,iptv-org,Collection of publicly available IPTV channels from all over the world,TypeScript,129931,7202,129931,21,1286699,master,2018-11-14T22:00:57Z,2026-07-02T14:26:48Z,The Unlicense,"iptv, m3u, playlist, streams, tv",public,True,False,False,True,False,False
clash-verge-rev,clash-verge-rev/clash-verge-rev,clash-verge-rev,"A modern GUI client based on Tauri, designed to run in Windows, macOS and Linux for tailored proxy experience",TypeScript,129193,9375,129193,424,76577,dev,2023-11-21T18:24:03Z,2026-07-02T14:26:51Z,GNU General Public License v3.0,"clash, clash-meta, clash-verge, linux, mac, mihomo, tauri-app, windows",public,True,True,True,False,False,False
