repository_name,full_name,owner,description,language,stars,forks,watchers,open_issues,size_kb,default_branch,created_at,updated_at,license,topics,visibility,has_issues,has_projects,has_wiki,has_pages,archived,disabled
redis,redis/redis,redis,"For developers, who are building real-time data-driven applications, Redis is the preferred, fastest, and most feature-rich cache, data structure server, and document and vector query engine.",C,75222,24693,75222,2860,213885,unstable,2009-03-21T22:32:25Z,2026-07-02T12:59:48Z,Other,"cache, caching, database, distributed-systems, in-memory, in-memory-database, json, key-value, key-value-store, message-broker, message-queue, no-sql, nosql, open-source, real-time, realtime, redis, time-series, vector-databases, vector-search",public,True,True,False,False,False,False
ChinaTextbook,TapXWorld/ChinaTextbook,TapXWorld,所有小初高、大学PDF教材。,Roff,75205,16885,75205,114,43543927,master,2020-01-05T04:11:06Z,2026-07-02T13:49:11Z,,,public,True,True,True,False,False,False
grafana,grafana/grafana,grafana,"The open and composable observability and data visualization platform. Visualize metrics, logs, and traces from multiple sources like Prometheus, Loki, Elasticsearch, InfluxDB, Postgres and many more. ",TypeScript,75190,14172,75190,3564,1826697,main,2013-12-11T15:59:56Z,2026-07-02T14:21:31Z,GNU Affero General Public License v3.0,"alerting, analytics, business-intelligence, dashboard, data-visualization, elasticsearch, go, grafana, hacktoberfest, influxdb, metrics, monitoring, mysql, postgres, prometheus",public,True,True,False,True,False,False
tesseract,tesseract-ocr/tesseract,tesseract-ocr,Tesseract Open Source OCR Engine (main repository),C++,75061,10679,75061,476,54852,main,2014-08-12T18:04:59Z,2026-07-02T12:40:27Z,Apache License 2.0,"hacktoberfest, lstm, machine-learning, ocr, ocr-engine, tesseract, tesseract-ocr",public,True,True,True,False,False,False
openai-cookbook,openai/openai-cookbook,openai,Examples and guides for using the OpenAI API,Jupyter Notebook,74512,12609,74512,222,930844,main,2022-03-11T02:08:53Z,2026-07-02T14:25:42Z,MIT License,"chatgpt, gpt-4, openai, openai-api",public,True,False,False,False,False,False
imgui,ocornut/imgui,ocornut,Dear ImGui: Bloat-free Graphical User interface for C++ with minimal dependencies,C++,74235,11840,74235,1233,128642,master,2014-07-21T14:29:47Z,2026-07-02T14:26:36Z,MIT License,"api, cplusplus, framework, game-development, game-engine, gamedev, gui, imgui, immediate-gui, library, multi-platform, native, toolkit, tools, ui",public,True,False,True,False,False,False
open-design,nexu-io/open-design,nexu-io,"🎨 Local-first, open-source Claude Design alternative. 🖥️ Native desktop app. ⚡ 259+ Skills · ✨ 142+ Design Systems 🖼️ Web · desktop · mobile prototypes · slides · images · videos · HyperFrames 📦 Sandboxed preview · HTML/PDF/PPTX/MP4 export 🤖 Claude Code / OpenClaw / Codex / Cursor / OpenCode / Qwen / Copilot / Hermes / Kimi & 17+ CLIs.",TypeScript,74117,8436,74117,484,1575503,main,2026-04-28T04:25:20Z,2026-07-02T14:27:41Z,Apache License 2.0,"agent-skills, ai-agents, ai-design, byok, claude-code-for-design, claude-design, codex-design, coding-agents, cursor-design, design-systems, design-tools, desktop-app, figma-alternative, generative-ai, hermes-agent, local-first, no-code, prototyping, ui-generator, vibe-coding",public,True,True,True,False,False,False
union,unionlabs/union,unionlabs,"The trust-minimized, zero-knowledge bridging protocol, designed for censorship resistance, extremely high security, and usage in decentralized finance.",Rust,73930,3892,73930,191,483738,main,2023-05-16T22:33:39Z,2026-07-02T09:59:46Z,Apache License 2.0,"astro, blockchain, cosmos, cosmwasm, ethereum, evm, golang, indexer, interoperability, move, nix, prover, relayer, rust, solidity, svelte, typescipt, typescript, zero-knowledge",public,True,True,True,False,False,False
awesome-react,enaqx/awesome-react,enaqx,A collection of awesome things regarding React ecosystem,,73816,7592,73816,45,2580,master,2014-08-06T05:31:44Z,2026-07-02T13:39:18Z,,"awesome, awesome-list, javascript, react, react-apps, react-native, react-tutorial, samples, tutorial, typescript",public,True,False,False,False,False,False
caddy,caddyserver/caddy,caddyserver,Fast and extensible multi-platform HTTP/1-2-3 web server with automatic HTTPS,Go,73682,4807,73682,262,21557,master,2015-01-13T19:45:03Z,2026-07-02T14:02:09Z,Apache License 2.0,"acme, automatic-https, caddy, caddyfile, go, golang, http, http-server, http3, https, privacy, reverse-proxy, security, tls, web-server",public,True,False,False,False,False,False
superset,apache/superset,apache,Apache Superset is a Data Visualization and Data Exploration Platform,TypeScript,73630,17780,73630,887,1013716,master,2015-07-21T18:55:34Z,2026-07-02T14:05:47Z,Apache License 2.0,"analytics, apache, apache-superset, asf, bi, business-analytics, business-intelligence, data-analysis, data-analytics, data-engineering, data-science, data-visualization, data-viz, flask, python, react, sql-editor, superset",public,True,True,True,True,False,False
obs-studio,obsproject/obs-studio,obsproject,OBS Studio - Free and open source software for live streaming and screen recording,C,73602,9393,73602,1110,81243,master,2013-10-01T02:40:31Z,2026-07-02T13:48:15Z,GNU General Public License v2.0,"c, c-plus-plus, directshow, facebook-live, ffmpeg, game-capture, live-streaming, screen-capture, twitch-tv, video-recording, youtube-live",public,True,True,True,True,False,False
awesome-vue,vuejs/awesome-vue,vuejs,🎉 A curated list of awesome things related to Vue.js,,73560,9452,73560,70,12672,master,2015-10-20T00:16:14Z,2026-07-02T13:59:55Z,MIT License,,public,True,True,False,False,False,False
the-algorithm,twitter/the-algorithm,twitter,Source code for the X Recommendation Algorithm,Scala,73485,13269,73485,515,8422,main,2023-03-27T14:57:57Z,2026-07-02T14:00:35Z,GNU Affero General Public License v3.0,,public,True,False,False,False,False,False
cs-self-learning,PKUFlyingPig/cs-self-learning,PKUFlyingPig,计算机自学指南,HTML,73450,7899,73450,151,69980,master,2021-10-20T13:43:42Z,2026-07-02T14:06:48Z,MIT License,,public,True,True,True,True,False,False
cpython,python/cpython,python,The Python programming language,Python,73417,34804,73417,9447,842602,main,2017-02-10T19:23:51Z,2026-07-02T14:28:20Z,Other,,public,True,True,False,False,False,False
AppFlowy,AppFlowy-IO/AppFlowy,AppFlowy-IO,"Bring projects, wikis, and teams together with AI. AppFlowy is the AI collaborative workspace where you achieve more without losing control of your data. The leading open source Notion alternative.",Dart,73173,5560,73173,998,93897,main,2021-06-16T12:56:48Z,2026-07-02T14:29:13Z,GNU Affero General Public License v3.0,"blog, confluence-alternative, content-management, content-services, documentation, flutter, note-taking, notion-alternative, project-management, task-management, team-collaboration, wiki",public,True,True,False,False,False,False
stable-diffusion,CompVis/stable-diffusion,CompVis,A latent text-to-image diffusion model,Jupyter Notebook,73161,10590,73161,616,43676,main,2022-08-10T14:36:44Z,2026-07-02T13:20:44Z,Other,,public,True,True,True,False,False,False
awesome-machine-learning,josephmisiti/awesome-machine-learning,josephmisiti,"A curated list of awesome Machine Learning frameworks, libraries and software.",Python,73154,15523,73154,17,2685,master,2014-07-15T19:11:19Z,2026-07-02T13:21:53Z,Other,,public,True,False,False,True,False,False
screenshot-to-code,abi/screenshot-to-code,abi,Drop in a screenshot and convert it to clean code (HTML/Tailwind/React/Vue),Python,73141,9001,73141,123,10452,main,2023-11-14T17:53:32Z,2026-07-02T13:59:43Z,MIT License,,public,True,True,True,False,False,False
Front-End-Checklist,thedaviddias/Front-End-Checklist,thedaviddias,"🗂 The essential checklist for modern web development, for humans and AI agents",MDX,73097,6647,73097,3,7709,main,2017-10-16T10:12:36Z,2026-07-02T14:10:55Z,,"ai-agent, ai-agents, checklist, css, front-end-developer-tool, front-end-development, frontend, guidelines, html, javascript, lists, reference, resources, rules, web-development",public,True,False,False,True,False,False
MinerU,opendatalab/MinerU,opendatalab,Transforms complex documents like PDFs and Office docs into LLM-ready markdown/JSON for your Agentic workflows.,Python,73037,6126,73037,34,156635,master,2024-02-29T08:52:34Z,2026-07-02T14:29:07Z,Other,"ai4science, document-analysis, docx, extract-data, layout-analysis, ocr, parser, pdf, pdf-converter, pdf-extractor-llm, pdf-extractor-pretrain, pdf-extractor-rag, pdf-parser, pptx, python, xlsx",public,True,True,False,True,False,False
LlamaFactory,hiyouga/LlamaFactory,hiyouga,Unified Efficient Fine-Tuning of 100+ LLMs & VLMs (ACL 2024),Python,72901,8909,72901,1058,13736,main,2023-05-28T10:09:12Z,2026-07-02T13:37:56Z,Apache License 2.0,"agent, ai, deepseek, fine-tuning, gemma, gpt, instruction-tuning, large-language-models, llama, llama3, llm, lora, moe, nlp, peft, qlora, quantization, qwen, rlhf, transformers",public,True,False,False,True,False,False
strapi,strapi/strapi,strapi,"🚀 Strapi is the leading open-source headless CMS. It’s 100% JavaScript/TypeScript, fully customizable, and developer-first.",TypeScript,72580,9780,72580,545,659490,develop,2015-09-30T15:34:48Z,2026-07-02T14:23:17Z,Other,"api, cms, cms-framework, content-management, content-management-system, customizable, dashboard, graphql, hacktoberfest, headless-cms, jamstack, javascript, mysql, no-code, nodejs, posgresql, rest, strapi, typescript",public,True,True,False,False,False,False
paperclip,paperclipai/paperclip,paperclipai,The open-source app everyone uses to manage agents at work,TypeScript,72559,13515,72559,4900,112170,master,2026-03-02T15:01:51Z,2026-07-02T14:17:08Z,MIT License,,public,True,True,False,False,False,False
tabby,Eugeny/tabby,Eugeny,A terminal for a more modern age,TypeScript,72550,4093,72550,2736,98946,master,2016-12-23T09:06:10Z,2026-07-02T14:06:47Z,MIT License,"serial, ssh-client, telnet-client, terminal, terminal-emulators",public,True,True,True,True,False,False
daytona,daytonaio/daytona,daytonaio,Daytona is a Secure and Elastic Infrastructure for Running AI-Generated Code,,72319,5664,72319,441,153748,main,2024-02-06T08:21:20Z,2026-07-02T14:12:00Z,,"agentic-workflow, ai, ai-agents, ai-runtime, ai-sandboxes, code-execution, code-interpreter, developer-tools",public,True,True,True,False,False,False
awesome-scalability,binhnguyennus/awesome-scalability,binhnguyennus,"The Patterns of Scalable, Reliable, and Performant Large-Scale Systems",,72171,7031,72171,23,1607,master,2017-12-27T03:46:40Z,2026-07-02T13:55:39Z,MIT License,"architecture, awesome, awesome-list, backend, big-data, computer-science, design-patterns, devops, distributed-systems, interview, interview-practice, interview-questions, lists, machine-learning, programming, resources, scalability, system, system-design, web-development",public,False,False,False,True,False,False
awesome-cpp,fffaraz/awesome-cpp,fffaraz,"A curated list of awesome C++ (or C) frameworks, libraries, resources, and shiny things. Inspired by awesome-... stuff.",,72056,8304,72056,310,2491,master,2014-07-17T08:51:11Z,2026-07-02T13:38:24Z,MIT License,"awesome, awesome-list, c, c-plus-plus, cpp, cpp-library, cppcon, libraries, list, lists, programming-tutorial, resources",public,True,False,False,True,False,False
SecLists,danielmiessler/SecLists,danielmiessler,"SecLists is the security tester's companion. It's a collection of multiple types of lists used during security assessments, collected in one place. List types include usernames, passwords, URLs, sensitive data patterns, fuzzing payloads, web shells, and many more.",PHP,71875,25050,71875,9,3358068,master,2012-02-19T01:30:18Z,2026-07-02T13:33:20Z,MIT License,,public,True,True,True,False,False,False
reveal.js,hakimel/reveal.js,hakimel,The HTML Presentation Framework,JavaScript,71856,16809,71856,906,34577,master,2011-06-07T18:54:22Z,2026-07-02T14:19:39Z,MIT License,"presentations, slides, slideshow",public,True,True,True,True,False,False
flask,pallets/flask,pallets,The Python micro framework for building web applications.,Python,71794,16893,71794,7,12008,main,2010-04-06T11:11:59Z,2026-07-02T10:49:34Z,"BSD 3-Clause ""New"" or ""Revised"" License","flask, jinja, pallets, python, web-framework, werkzeug, wsgi",public,True,False,False,False,False,False
moby,moby/moby,moby,The Moby Project - a collaborative project for the container ecosystem to assemble container-based systems,Go,71772,18976,71772,3803,263706,master,2013-01-18T18:10:57Z,2026-07-02T13:47:17Z,Apache License 2.0,"containers, docker, go, golang",public,True,True,True,False,False,False
protobuf,protocolbuffers/protobuf,protocolbuffers,Protocol Buffers - Google's data interchange format,C++,71452,16175,71452,253,230352,main,2014-08-26T15:52:15Z,2026-07-02T12:24:57Z,Other,"marshalling, protobuf, protobuf-runtime, protoc, protocol-buffers, protocol-compiler, rpc, serialization",public,True,True,True,True,False,False
ponytail,DietrichGebert/ponytail,DietrichGebert,Makes your AI agent think like the laziest senior dev in the room. The best code is the code you never wrote.,JavaScript,71353,3685,71353,123,1944,main,2026-06-12T00:52:37Z,2026-07-02T14:28:33Z,MIT License,"agent-skills, ai-agents, claude, claude-code, claude-code-plugin, cursor-rules, developer-tools, llm, prompt-engineering, yagni",public,True,True,True,False,False,False
gpt_academic,binary-husky/gpt_academic,binary-husky,"为GPT/GLM等LLM大语言模型提供实用化交互接口，特别优化论文阅读/润色/写作体验，模块化设计，支持自定义快捷按钮&函数插件，支持Python和C++等项目剖析&自译解功能，PDF/LaTex论文翻译&总结功能，支持并行问询多种LLM模型，支持chatglm3等本地模型。接入通义千问, deepseekcoder, 讯飞星火, 文心一言, llama2, rwkv, claude2, moss等。",Python,71028,8354,71028,329,72756,master,2023-03-20T09:05:13Z,2026-07-02T14:14:55Z,GNU General Public License v3.0,"academic, chatglm-6b, chatgpt, gpt-4, large-language-models",public,True,True,True,False,False,False
act,nektos/act,nektos,Run your GitHub Actions locally 🚀,Go,70919,1967,70919,341,17761,master,2019-01-02T19:53:43Z,2026-07-02T14:29:54Z,MIT License,"ci, devops, github-actions, golang",public,True,True,False,False,False,False
crawl4ai,unclecode/crawl4ai,unclecode,"🚀🤖 Crawl4AI: Open-source LLM Friendly Web Crawler & Scraper. Don't be shy, join here: https://discord.gg/jP8KfhDhyN",Python,70734,7265,70734,116,150826,main,2024-05-09T09:48:50Z,2026-07-02T14:17:39Z,Apache License 2.0,,public,True,True,True,False,False,False
anime,juliangarnier/anime,juliangarnier,JavaScript animation engine,JavaScript,70576,4760,70576,108,182753,master,2016-03-13T21:37:45Z,2026-07-02T13:50:01Z,MIT License,"animation, anime, canvas, css, javascript, javascript-library, svg",public,True,True,True,True,False,False
ghidra,NationalSecurityAgency/ghidra,NationalSecurityAgency,Ghidra is a software reverse engineering (SRE) framework,Java,70370,7719,70370,1874,410989,master,2019-03-01T03:27:48Z,2026-07-02T14:01:37Z,Apache License 2.0,"disassembler, reverse-engineering, software-analysis",public,True,True,True,False,False,False
Understand-Anything,Egonex-AI/Understand-Anything,Egonex-AI,"Graphs that teach > graphs that impress. Turn any code into an interactive knowledge graph you can explore, search, and ask questions about. Works with Claude Code, Codex, Cursor, Copilot, Gemini CLI, and more.",TypeScript,70321,5817,70321,263,33001,main,2026-03-15T02:30:51Z,2026-07-02T14:15:30Z,MIT License,"antigravity-skills, business-knowledge, claude-code, claude-skills, codebase-analysis, codex, codex-skills, developer-tools-ai-agent, gemini-cli-skills, karpathy-llm-wiki, knowledge-base, knowledge-graph, memory, opencode-skills, pi-agent, understandcode, vibe-coding",public,True,True,True,True,False,False
swift,swiftlang/swift,swiftlang,The Swift Programming Language,Swift,70124,10748,70124,9062,1357137,main,2015-10-23T21:15:07Z,2026-07-02T14:07:06Z,Apache License 2.0,,public,True,False,False,False,False,False
AFFiNE,toeverything/AFFiNE,toeverything,"There can be more than Notion and Miro. AFFiNE(pronounced [ə‘fain]) is a next-gen knowledge base that brings planning, sorting and creating all together. Privacy first, open-source, customizable and ready to use. ",TypeScript,69990,5004,69990,651,439351,canary,2022-07-31T18:45:21Z,2026-07-02T13:48:10Z,Other,"app, crdt, editor, electron, knowledge-base, markdown, miro, notes, notion, notion-alternative, rust, rust-lang, rust-language, table, tableview, whiteboard, wiki, workspace",public,True,True,False,False,False,False
OpenBB,OpenBB-finance/OpenBB,OpenBB-finance,"Financial data platform for analysts, quants and AI agents.",Python,69935,7078,69935,72,2418732,develop,2020-12-20T10:46:38Z,2026-07-02T11:51:16Z,Other,"ai, crypto, derivatives, economics, equity, finance, fixed-income, machine-learning, openbb, options, python, quantitative-finance, stocks",public,True,True,False,True,False,False
learn-claude-code,shareAI-lab/learn-claude-code,shareAI-lab,"Bash is all you need -  A nano claude code–like 「agent harness」, built from 0 to 1",Python,69596,11344,69596,44,2160,main,2025-06-29T15:34:15Z,2026-07-02T14:30:10Z,MIT License,"agent, agent-development, ai-agent, claude, claude-code, educational, llm, python, teaching, tutorial",public,True,True,True,False,False,False
awesome-courses,prakhar1989/awesome-courses,prakhar1989,:books: List of awesome university courses for learning Computer Science!,,69450,8385,69450,63,1401,master,2014-11-15T18:36:49Z,2026-07-02T12:24:59Z,,"awesome, awesome-list, computer-science, courses",public,True,True,False,True,False,False
express,expressjs/express,expressjs,"Fast, unopinionated, minimalist web framework for node.",JavaScript,69196,23954,69196,225,9823,master,2009-06-26T18:56:01Z,2026-07-02T14:16:23Z,MIT License,"express, javascript, nodejs, server",public,True,False,True,False,False,False
MetaGPT,FoundationAgents/MetaGPT,FoundationAgents,"🌟 The Multi-Agent Framework: First AI Software Company, Towards Natural Language Programming",Python,69151,8817,69151,135,184037,main,2023-06-30T09:04:55Z,2026-07-02T14:09:25Z,MIT License,"agent, gpt, llm, metagpt, multi-agent",public,True,True,True,False,False,False
ansible,ansible/ansible,ansible,"Ansible is a radically simple IT automation platform that makes your applications and systems easier to deploy and maintain. Automate everything from code deployment to network configuration to cloud management, in a language that approaches plain English, using SSH, with no agents to install on remote systems. https://docs.ansible.com.",Python,69034,24096,69034,800,265363,devel,2012-03-06T14:58:02Z,2026-07-02T14:27:01Z,GNU General Public License v3.0,"ansible, python",public,True,True,False,False,False,False
agent-skills,addyosmani/agent-skills,addyosmani,Production-grade engineering skills for AI coding agents.,Shell,68539,7428,68539,147,591,main,2026-02-15T20:20:26Z,2026-07-02T14:27:38Z,MIT License,"agent-skills, antigravity, antigravity-ide, claude-code, cursor, skills",public,True,True,True,False,False,False
node,base/node,base,Everything required to run your own Base node,Shell,68501,3256,68501,16,3035,main,2023-02-01T13:55:02Z,2026-07-02T05:37:45Z,MIT License,,public,True,True,True,False,False,False
ai-agents-for-beginners,microsoft/ai-agents-for-beginners,microsoft,12 Lessons to Get Started Building AI Agents,Jupyter Notebook,68392,22687,68392,7,3759013,main,2024-11-28T10:42:52Z,2026-07-02T14:28:48Z,MIT License,"agentic-ai, agentic-framework, agentic-rag, ai-agents, ai-agents-framework, autogen, generative-ai, semantic-kernel",public,True,True,True,True,False,False
Apollo-11,chrislgarry/Apollo-11,chrislgarry,Original Apollo 11 Guidance Computer (AGC) source code for the command and lunar modules.,Assembly,68189,7709,68189,132,3427,master,2014-04-03T15:45:02Z,2026-07-02T09:39:47Z,Other,"agc, apollo, hacktoberfest, nasa",public,True,True,True,False,False,False
rtk,rtk-ai/rtk,rtk-ai,"CLI proxy that reduces LLM token consumption by 60-90% on common dev commands. Single Rust binary, zero dependencies",Rust,67890,4203,67890,1461,5417,develop,2026-01-22T16:54:16Z,2026-07-02T14:29:02Z,Apache License 2.0,"agentic-coding, ai-coding, anthropic, claude-code, cli, command-line-tool, cost-reduction, developer-tools, llm, open-source, productivity, rust, token-optimization",public,True,True,True,False,False,False
unsloth,unslothai/unsloth,unslothai,"Unsloth Studio is a web UI for training and running open models like Gemma 4, Qwen3.6, DeepSeek, gpt-oss locally.",Python,67744,6088,67744,1032,134303,main,2023-11-29T16:50:09Z,2026-07-02T13:52:22Z,Apache License 2.0,"agent, deepseek, fine-tuning, gemma, gemma3, gpt-oss, llama, llama3, llm, llms, mistral, openai, qwen, reinforcement-learning, self-hosted, text-to-speech, tts, ui, unsloth",public,True,False,False,False,False,False
Scrapling,D4Vinci/Scrapling,D4Vinci,🕷️ An adaptive Web Scraping framework that handles everything from a single request to a full-scale crawl!,Python,67741,6695,67741,10,8690,main,2024-10-13T20:29:53Z,2026-07-02T14:29:22Z,"BSD 3-Clause ""New"" or ""Revised"" License","ai, ai-scraping, automation, crawler, crawling, crawling-python, data, data-extraction, mcp, mcp-server, playwright, python, scraping, selectors, stealth, web-scraper, web-scraping, web-scraping-python, webscraping, xpath",public,True,True,True,False,False,False
MiroFish,666ghj/MiroFish,666ghj,"A Simple and Universal Swarm Intelligence Engine, Predicting Anything. 简洁通用的群体智能引擎，预测万物",Python,67693,10552,67693,326,16526,main,2025-11-26T04:23:02Z,2026-07-02T14:19:39Z,GNU Affero General Public License v3.0,"agent-memory, financial-forecasting, future-prediction, knowledge-graph, llms, multi-agent-simulation, public-opinion-analysis, python3, social-prediction, swarm-intelligence",public,True,True,True,False,False,False
Chart.js,chartjs/Chart.js,chartjs,Simple HTML5 Charts using the <canvas> tag,JavaScript,67542,11940,67542,568,43590,master,2013-03-17T23:56:36Z,2026-07-02T13:57:56Z,MIT License,"canvas, chart, graph, html5, html5-charts, javascript",public,True,True,False,False,False,False
pi,earendil-works/pi,earendil-works,"AI agent toolkit: unified LLM API, agent loop, TUI, coding agent CLI",TypeScript,67166,8231,67166,45,53159,main,2025-08-09T14:03:50Z,2026-07-02T14:22:37Z,MIT License,,public,True,True,True,False,False,False
30-Days-Of-Python,Asabeneh/30-Days-Of-Python,Asabeneh,The 30 Days of Python programming challenge is a step-by-step guide to learn the Python programming language in 30 days. This challenge may take more than 100 days. Follow your own pace. These videos may help too: https://www.youtube.com/channel/UC7PNRuno1rzYPb1xLa4yktw,Python,67051,12515,67051,170,30842,master,2019-11-19T17:24:16Z,2026-07-02T14:20:38Z,,"30-days-of-python, data, data-science, database, flask, fullstack, github, heroku, matplotlib, ml, mongodb, numpy, pandas, python, python3",public,True,True,True,False,False,False
annotated_deep_learning_paper_implementations,labmlai/annotated_deep_learning_paper_implementations,labmlai,"🧑‍🏫 60+ Implementations/tutorials of deep learning papers with side-by-side notes 📝; including transformers (original, xl, switch, feedback, vit, ...), optimizers (adam, adabelief, sophia, ...), gans(cyclegan, stylegan2, ...), 🎮 reinforcement learning (ppo, dqn), capsnet, distillation, ... 🧠",Python,67031,6729,67031,32,156370,master,2020-08-25T02:29:34Z,2026-07-02T13:53:44Z,MIT License,"attention, deep-learning, deep-learning-tutorial, gan, literate-programming, lora, machine-learning, neural-networks, optimizers, pytorch, reinforcement-learning, transformer, transformers",public,True,True,True,True,False,False
echarts,apache/echarts,apache,"Apache ECharts is a powerful, interactive charting and data visualization library for browser",TypeScript,66720,19807,66720,1609,270504,master,2013-04-03T03:18:59Z,2026-07-02T11:02:22Z,Apache License 2.0,"apache, canvas, charting-library, charts, data-visualization, data-viz, echarts, svg, visualization",public,True,True,True,False,False,False
awesome-claude-skills,ComposioHQ/awesome-claude-skills,ComposioHQ,"A curated list of awesome Claude Skills, resources, and tools for customizing Claude AI workflows",Python,66600,7413,66600,907,4519,master,2025-10-17T07:15:01Z,2026-07-02T14:28:24Z,,"agent-skills, ai-agents, antigravity, automation, claude, claude-code, codex, composio, cursor, developer-tools, gemini-cli, mcp, openai-codex, rube, saas, skill, workflow-automation",public,True,True,True,False,False,False
scikit-learn,scikit-learn/scikit-learn,scikit-learn,scikit-learn: machine learning in Python,Python,66529,27137,66529,2107,186215,main,2010-08-17T09:43:38Z,2026-07-02T14:04:38Z,"BSD 3-Clause ""New"" or ""Revised"" License","data-analysis, data-science, machine-learning, python, statistics",public,True,True,True,False,False,False
33-js-concepts,leonardomso/33-js-concepts,leonardomso,📜 33 JavaScript concepts every developer should know.,JavaScript,66491,9164,66491,1,2906,master,2018-09-04T13:27:04Z,2026-07-02T13:45:42Z,MIT License,"angular, concepts, es6, es6-javascript, hacktoberfest, javascript, javascript-closures, javascript-engines, javascript-programming, nodejs, primitive-types, programming, react",public,True,True,True,False,False,False
