repository_name,full_name,owner,description,language,stars,forks,watchers,open_issues,size_kb,default_branch,created_at,updated_at,license,topics,visibility,has_issues,has_projects,has_wiki,has_pages,archived,disabled
manim,ManimCommunity/manim,ManimCommunity,A community-maintained Python framework for creating mathematical animations. ,Python,39310,2941,39310,520,47264,main,2020-05-19T02:37:13Z,2026-07-02T14:08:39Z,MIT License,"animations, hacktoberfest, manim, math, python",public,True,True,True,False,False,False
awesome-system-design-resources,ashishps1/awesome-system-design-resources,ashishps1,Learn System Design concepts and prepare for interviews using free resources.,Java,39305,8419,39305,14,2340,main,2023-10-25T01:50:42Z,2026-07-02T13:50:57Z,GNU General Public License v3.0,"awesome, backend, computer-science, distributed-systems, high-level-design, hld, interview, interview-questions, scalability, system-design",public,True,True,True,False,False,False
novu,novuhq/novu,novuhq,The open-source communication infrastructure for agents and products,TypeScript,39233,4345,39233,88,467159,next,2021-08-26T15:22:44Z,2026-07-02T13:53:34Z,Other,"agents, communication, email, inbox, infrastructure, nodejs, notification-center, notifications, novu, push-notifications, react, reactjs, sms, transactional, typescript",public,True,False,False,False,False,False
halo,halo-dev/halo,halo-dev,Halo 是一款强大易用的开源建站工具，从个人博客、知识库，到企业官网、在线商城，Halo 都能助您轻松实现，一站式满足您的多样化建站需求。,Java,39201,10311,39201,136,87089,main,2018-03-21T12:56:52Z,2026-07-02T14:26:08Z,GNU General Public License v3.0,"blog, blog-engine, cms, content-management-system, halo, halocms, website-builder",public,True,True,False,False,False,False
leveldb,google/leveldb,google,LevelDB is a fast key-value storage library written at Google that provides an ordered mapping from string keys to string values.,C++,39196,8200,39196,395,1848,main,2014-08-27T21:17:52Z,2026-07-02T13:50:53Z,"BSD 3-Clause ""New"" or ""Revised"" License",,public,True,False,False,False,False,False
reactive-resume,amruthpillai/reactive-resume,amruthpillai,"A one-of-a-kind resume builder that keeps your privacy in mind. Completely secure, customizable, portable, open-source and free forever. Try it out today!",TypeScript,39190,4409,39190,105,211850,main,2020-03-25T14:08:22Z,2026-07-02T14:01:38Z,MIT License,"better-auth, hacktoberfest, react, resume, resume-builder, self-hosted, tailwindcss, tanstack-start",public,True,False,False,True,False,False
bark,suno-ai/bark,suno-ai,🔊 Text-Prompted Generative Audio Model,Jupyter Notebook,39188,4671,39188,268,2641,main,2023-04-07T19:34:48Z,2026-07-02T12:58:12Z,MIT License,,public,True,True,True,False,False,False
quivr,QuivrHQ/quivr,QuivrHQ,"Opiniated RAG for integrating GenAI in your apps 🧠   Focus on your product rather than the RAG. Easy integration in existing products with customisation!  Any LLM: GPT4, Groq, Llama. Any Vectorstore: PGVector, Faiss. Any Files. Anyway you want.",Python,39182,3722,39182,26,130685,main,2023-05-12T23:53:30Z,2026-07-02T13:10:11Z,Other,"ai, api, chatbot, chatgpt, database, docker, framework, frontend, groq, html, javascript, llm, openai, postgresql, privacy, rag, react, security, typescript, vector",public,True,True,False,False,False,False
outline,outline/outline,outline,"The fastest knowledge base for growing teams. Beautiful, realtime collaborative, feature packed, and markdown compatible.",TypeScript,39173,3382,39173,55,322702,main,2016-05-22T21:31:47Z,2026-07-02T14:07:37Z,Other,"docker, javascript, mobx, nodejs, react, slack, wiki",public,True,False,False,False,False,False
ink,vadimdemedes/ink,vadimdemedes,🌈 React for interactive command-line apps,TypeScript,39154,1016,39154,29,2145,master,2017-06-12T06:12:28Z,2026-07-02T10:11:36Z,MIT License,"cli, command-line, flexbox, interactive, javascript, react",public,True,True,False,False,False,False
duckdb,duckdb/duckdb,duckdb,DuckDB is an analytical in-process SQL database management system,C++,39149,3378,39149,547,460274,main,2018-06-26T15:04:45Z,2026-07-02T13:56:30Z,MIT License,"analytics, database, embedded-database, olap, sql",public,True,True,False,False,False,False
devdocs,freeCodeCamp/devdocs,freeCodeCamp,API Documentation Browser,Ruby,39144,2607,39144,236,32603,main,2013-10-24T18:16:07Z,2026-07-02T13:25:35Z,Mozilla Public License 2.0,"api-documentation, app, devdocs, developer-tools, docs, documentation, documentation-tool, offline, pwa",public,True,False,False,False,False,False
openscreen,siddharthvaddem/openscreen,siddharthvaddem,"Create stunning demos for free. Open-source, no subscriptions, no watermarks, and free for commercial use. An alternative to Screen Studio.",TypeScript,39127,2846,39127,49,170173,main,2025-10-10T05:36:55Z,2026-07-02T14:13:56Z,MIT License,"electron, open-source, pixijs, screen-capture, screen-recorder",public,True,True,True,False,True,False
claude-howto,luongnv89/claude-howto,luongnv89,"A visual, example-driven guide to Claude Code — from basic concepts to advanced agents, with copy-paste templates that bring immediate value.",Python,39115,4724,39115,25,13943,main,2025-11-07T22:59:34Z,2026-07-02T14:17:14Z,MIT License,"claude-code, guide, tutorial",public,True,True,True,True,False,False
llvm-project,llvm/llvm-project,llvm,The LLVM Project is a collection of modular and reusable compiler and toolchain technologies.,LLVM,39062,17691,39062,37316,4120576,main,2016-12-07T09:39:33Z,2026-07-02T14:08:59Z,Other,,public,True,False,False,False,False,False
CLIProxyAPI,router-for-me/CLIProxyAPI,router-for-me,"Wrap Antigravity, ChatGPT Codex, Claude Code, Grok Build as an OpenAI/Gemini/Claude/Codex compatible API service, allowing you to enjoy the free Gemini 3.1 Pro, GPT 5.5, Grok 4.3, Claude model through API",Go,38959,6443,38959,254,18722,main,2025-07-01T19:43:27Z,2026-07-02T14:13:49Z,MIT License,"antigravity, claude-code, cluade, codex, gemini, openai",public,True,True,False,False,False,False
polars,pola-rs/polars,pola-rs,"Extremely fast Query Engine for DataFrames, written in Rust",Rust,38904,2926,38904,2796,208183,main,2020-05-13T19:45:33Z,2026-07-02T14:20:17Z,MIT License,"arrow, dataframe, dataframe-library, dataframes, out-of-core, polars, python, rust",public,True,True,False,True,False,False
Sunshine,LizardByte/Sunshine,LizardByte,Self-hosted game stream host for Moonlight.,C++,38874,2063,38874,124,62763,master,2021-12-15T23:38:57Z,2026-07-02T13:48:23Z,GNU General Public License v3.0,"cpp, docker, flathub-pkg, game-stream, game-streaming, game-streaming-server, geforce-experience, homebrew-pkg, maintainer-wanted, moonlight, pacman-pkg, remote-desktop, replicator-custom-issues, replicator-release-notifications, rtd, winget-pkg",public,True,True,False,True,False,False
NewPipe,TeamNewPipe/NewPipe,TeamNewPipe,A libre lightweight streaming front-end for Android.,Java,38870,3660,38870,1419,88087,dev,2015-09-03T23:39:26Z,2026-07-02T09:27:53Z,GNU General Public License v3.0,"4k, android, bandcamp, download-videos, newpipe, peertube, soundcloud, translation, video, watch, youtube-video",public,True,True,True,False,False,False
materialize,Dogfalo/materialize,Dogfalo,"Materialize, a CSS Framework based on Material Design",JavaScript,38857,4623,38857,792,165834,v1-dev,2014-09-12T19:35:38Z,2026-07-01T12:26:02Z,MIT License,"css, css-framework, design, framework, javascript, material, material-design",public,True,True,True,True,False,False
multica,multica-ai/multica,multica-ai,"The open-source managed agents platform. Turn coding agents into real teammates — assign tasks, track progress, compound skills.",Go,38836,4845,38836,1141,70604,main,2026-01-13T17:59:46Z,2026-07-02T14:30:34Z,Other,,public,True,True,True,False,False,False
googletest,google/googletest,google,GoogleTest - Google Testing and Mocking Framework,C++,38760,10812,38760,566,14111,main,2015-07-28T15:07:53Z,2026-07-02T14:00:10Z,"BSD 3-Clause ""New"" or ""Revised"" License",,public,True,False,False,True,False,False
preact,preactjs/preact,preactjs,⚛️ Fast 3kB React alternative with the same modern API. Components & Virtual DOM.,JavaScript,38730,2040,38730,153,19352,main,2015-09-11T02:40:18Z,2026-07-02T12:25:05Z,MIT License,"components, dom, jsx, preact, react, vdom, virtual-dom",public,True,True,True,True,False,False
GPT_API_free,chatanywhere/GPT_API_free,chatanywhere,Free ChatGPT&DeepSeek API Key，免费ChatGPT&DeepSeek API。免费接入DeepSeek API和GPT4 API，支持 gpt | deepseek | claude | gemini | grok 等排名靠前的常用大模型。,,38653,2658,38653,19,5579,main,2023-04-23T12:42:08Z,2026-07-02T14:06:26Z,MIT License,"api, chatgpt, claude, deepseek, gemini, gpt, grok",public,True,True,True,False,False,False
lapce,lapce/lapce,lapce,Lightning-fast and Powerful Code Editor written in Rust,Rust,38606,1298,38606,888,28729,master,2018-02-06T08:41:06Z,2026-07-02T11:26:41Z,Apache License 2.0,"code-editor, developer-tools, rust, text-editor, vim",public,True,True,False,True,False,False
Folo,RSSNext/Folo,RSSNext,🧡 Folo is the AI RSS Reader,TypeScript,38599,2099,38599,372,75573,dev,2024-04-08T03:23:35Z,2026-07-02T14:22:11Z,GNU Affero General Public License v3.0,"ai, reader, rss, rss-reader, rsshub",public,True,True,True,False,False,False
qBittorrent,qbittorrent/qBittorrent,qbittorrent,qBittorrent BitTorrent client,C++,38553,4749,38553,2664,314270,master,2012-02-04T09:37:46Z,2026-07-02T13:38:00Z,Other,"bittorrent, bittorrent-client, c-plus-plus, crossplatform, torrent, torrent-client",public,True,True,True,False,False,False
python-cheatsheet,gto76/python-cheatsheet,gto76,Comprehensive Python Cheatsheet,Python,38547,6706,38547,0,13669,main,2018-01-25T04:16:53Z,2026-07-02T13:49:03Z,,"cheatsheet, python, python-cheatsheet, reference",public,True,True,True,True,False,False
ant-design-pro,ant-design/ant-design-pro,ant-design,👨🏻‍💻👩🏻‍💻 Use Ant Design like a Pro!,TypeScript,38494,8248,38494,45,41538,master,2017-08-25T10:40:44Z,2026-07-02T11:02:39Z,MIT License,"admin, ant-design, antd, antv, boilerplate, dashboard, enterprise, react, umi",public,True,True,True,True,False,False
metasploit-framework,rapid7/metasploit-framework,rapid7,Metasploit Framework,Ruby,38479,14888,38479,610,1227749,master,2011-08-30T06:13:20Z,2026-07-02T12:58:51Z,Other,hacktoberfest,public,True,True,True,True,False,False
spacedrive,spacedriveapp/spacedrive,spacedriveapp,"Spacedrive is an open source cross-platform file explorer, powered by a virtual distributed filesystem written in Rust.",Rust,38477,1305,38477,34,271488,main,2021-09-27T05:09:04Z,2026-07-02T14:10:10Z,Other,"cross-platform, distributed-systems, encryption, file-manager, open-source, rust, storage, typescript",public,True,False,False,False,False,False
engineering-blogs,kilimchoi/engineering-blogs,kilimchoi,A curated list of engineering blogs,Ruby,38372,2023,38372,149,1339,master,2015-06-13T18:25:17Z,2026-07-02T14:11:36Z,,"engineering-blogs, lists, programming-blogs, software-development, tech",public,True,True,True,False,False,False
ShareX,ShareX/ShareX,ShareX,"ShareX is a free and open-source application that enables users to capture or record any area of their screen with a single keystroke. It also supports uploading images, text, and various file types to a wide range of destinations.",C#,38371,3819,38371,651,74130,develop,2013-10-08T23:32:10Z,2026-07-02T14:29:07Z,GNU General Public License v3.0,"avalonia, capture, color-picker, csharp, dropbox, file-sharing, file-upload, ftp, gif, gif-recorder, image-annotation, ocr, productivity, region-capture, screen-capture, screen-recorder, screenshot, share, sharex, url-shortener",public,True,False,False,False,False,False
mattermost,mattermost/mattermost,mattermost,Mattermost is an open source platform for secure collaboration across the entire software development lifecycle..,TypeScript,38290,8795,38290,908,1211003,master,2015-06-15T06:50:02Z,2026-07-02T14:09:39Z,Other,"collaboration, golang, hacktoberfest, mattermost, monorepo, react, react-native",public,True,False,False,False,False,False
google-research,google-research/google-research,google-research,Google Research,Jupyter Notebook,38283,8449,38283,1979,1194674,master,2018-10-04T18:42:48Z,2026-07-02T14:30:25Z,Apache License 2.0,"ai, machine-learning, research",public,True,False,False,True,False,False
cli,httpie/cli,httpie,"🥧 HTTPie CLI  — modern, user-friendly command-line HTTP client for the API era. JSON support, colors, sessions, downloads, plugins & more.",Python,38270,3960,38270,300,6925,master,2012-02-25T12:39:13Z,2026-07-02T10:02:12Z,"BSD 3-Clause ""New"" or ""Revised"" License","api, api-client, api-testing, cli, client, curl, debugging, developer-tools, development, devops, http, http-client, httpie, json, python, rest, rest-api, terminal, usability, web",public,True,False,False,False,False,False
istio,istio/istio,istio,"Connect, secure, control, and observe services.",Go,38252,8344,38252,459,300001,master,2016-11-18T23:57:21Z,2026-07-02T10:35:28Z,Apache License 2.0,"api-management, circuit-breaker, consul, enforce-policies, envoy, fault-injection, kubernetes, lyft-envoy, microservice, microservices, nomad, polyglot-microservices, proxies, request-routing, resiliency, service-mesh",public,True,False,True,False,False,False
Langchain-Chatchat,chatchat-space/Langchain-Chatchat,chatchat-space,"Langchain-Chatchat（原Langchain-ChatGLM）基于 Langchain 与 ChatGLM, Qwen 与 Llama 等语言模型的 RAG 与 Agent 应用 | Langchain-Chatchat (formerly langchain-ChatGLM), local knowledge based LLM (like ChatGLM, Qwen and Llama) RAG and Agent app with langchain ",Python,38239,6216,38239,23,144496,master,2023-03-31T12:12:45Z,2026-07-02T12:55:59Z,Apache License 2.0,"chatbot, chatchat, chatglm, chatgpt, embedding, faiss, fastchat, gpt, knowledge-base, langchain, langchain-chatglm, llama, llm, milvus, ollama, qwen, rag, retrieval-augmented-generation, streamlit, xinference",public,True,True,True,False,False,False
MPAndroidChart,PhilJay/MPAndroidChart,PhilJay,"A powerful 🚀 Android chart view / graph view library, supporting line- bar- pie- radar- bubble- and candlestick charts as well as scaling, panning and animations.",Java,38200,8993,38200,2191,21593,master,2014-04-25T14:29:47Z,2026-07-02T14:03:47Z,Other,"android, chart, graph, java, mpandroidchart",public,True,True,True,False,False,False
impress.js,impress/impress.js,impress,It's a presentation framework based on the power of CSS3 transforms and transitions in modern browsers and inspired by the idea behind prezi.com.,JavaScript,38189,6587,38189,60,4390,master,2011-12-28T22:23:19Z,2026-07-02T12:00:41Z,MIT License,,public,True,True,True,True,False,False
free-claude-code,Alishahryar1/free-claude-code,Alishahryar1,"Use claude code and codex for free in the terminal, VSCode extension, and discord like OpenClaw (voice supported)",Python,38169,6036,38169,357,5209,main,2026-01-28T19:02:30Z,2026-07-02T14:30:30Z,MIT License,,public,True,True,True,False,False,False
tesseract.js,naptha/tesseract.js,naptha,Pure Javascript OCR for more than 100 Languages 📖🎉🖥,JavaScript,38168,2359,38168,45,109272,master,2015-06-24T02:49:52Z,2026-07-02T09:17:55Z,Apache License 2.0,"deep-learning, javascript, ocr, tesseract, webassembly",public,True,True,False,True,False,False
ToolJet,ToolJet/ToolJet,ToolJet,"ToolJet is the open-source foundation of ToolJet AI - the enterprise app generation platform for building internal tools, dashboard, business applications, workflows and AI agents 🚀",JavaScript,38123,5154,38123,1011,1666725,main,2021-03-30T08:51:34Z,2026-07-02T12:50:06Z,GNU Affero General Public License v3.0,"ai-app-builder, docker, hacktoberfest, internal-applications, internal-project, internal-tool, internal-tools, javascript, kubernetes, low-code, low-code-development-platform, low-code-framework, no-code, nodejs, reactjs, self-hosted, typescript, web-development-tools, workflow-automation",public,True,True,False,False,False,False
aspnetcore,dotnet/aspnetcore,dotnet,"ASP.NET Core is a cross-platform .NET framework for building modern cloud-based web applications on Windows, Mac, or Linux.",C#,38123,10725,38123,4046,384606,main,2014-03-11T06:09:42Z,2026-07-02T14:26:54Z,MIT License,"aspnetcore, dotnet, hacktoberfest, help-wanted",public,True,True,True,False,False,False
awesome-deepseek-integration,deepseek-ai/awesome-deepseek-integration,deepseek-ai,Integrate the DeepSeek API into popular software,,38086,4169,38086,105,80206,main,2024-01-11T02:43:17Z,2026-07-02T13:32:42Z,Creative Commons Zero v1.0 Universal,"awesome, deepseek",public,True,True,False,False,False,False
RevokeMsgPatcher,huiyadanli/RevokeMsgPatcher,huiyadanli,:trollface: A hex editor for WeChat/QQ/TIM - PC版微信/QQ/TIM防撤回补丁（我已经看到了，撤回也没用了）,C#,38061,4016,38061,56,3755,master,2019-07-21T15:12:52Z,2026-07-02T11:11:14Z,GNU General Public License v3.0,"hex-editor, patch, pc, qq, revoke, revokemsg, tim, tool, wechat, windows",public,True,True,True,False,False,False
ruoyi-vue-pro,YunaiV/ruoyi-vue-pro,YunaiV,🔥 官方推荐 🔥 RuoYi-Vue 全新 Pro 版本，优化重构所有功能。基于 Spring Boot + MyBatis Plus + Vue & Element 实现的后台管理系统 + 微信小程序，支持 RBAC 动态权限、数据权限、SaaS 多租户、Flowable 工作流、三方登录、支付、短信、商城、CRM、ERP、MES、IM、AI 大模型、IoT 物联网等功能。你的 ⭐️ Star ⭐️，是作者生发的动力！,Java,38041,8247,38041,3,196028,master,2021-01-24T03:18:25Z,2026-07-02T12:23:31Z,MIT License,"flowable, mybatis-plus, mysql, redis, redisson, spring-security, springboot, vue",public,True,True,True,False,False,False
interview,huihut/interview,huihut,"📚 C/C++ 技术面试基础知识总结，包括语言、程序库、数据结构、算法、系统、网络、链接装载库等知识及面试经验、招聘、内推等信息。This repository is a summary of the basic knowledge of recruiting job seekers and beginners in the direction of C/C++ technology, including language, program library, data structure, algorithm, system, network, link loading library, interview experience, recruitment, recommendation, etc.",C++,38004,8090,38004,3,5713,master,2018-02-09T09:49:48Z,2026-07-02T13:29:49Z,Other,"algorithm, c, cpp, data-structures, database, interview, interview-practice, interview-preparation, interview-questions, interviews, leetcode, operating-system, stl",public,True,True,True,True,False,False
drawdb,drawdb-io/drawdb,drawdb-io,"Free, simple, and intuitive online database diagram editor and SQL generator.",JavaScript,37929,3072,37929,225,6985,main,2023-07-16T17:09:20Z,2026-07-02T14:12:51Z,GNU Affero General Public License v3.0,"database-schema, diagram-editor, editor, erd, erdiagram, indexeddb, javascript, mariadb, oracle-database, oracle-db, postgresql, react, sql, sql-server, sqlite, svg, tailwindcss",public,True,True,False,False,False,False
portainer,portainer/portainer,portainer,Making Docker and Kubernetes management easy.,TypeScript,37864,2855,37864,749,88548,develop,2016-05-19T20:15:28Z,2026-07-02T13:32:21Z,zlib License,"docker, docker-compose, docker-container, docker-deployment, docker-image, docker-swarm, docker-ui, dockerfile, hacktoberfest, kubernetes, moby, portainer, ui",public,True,True,False,False,False,False
sqlmap,sqlmapproject/sqlmap,sqlmapproject,Automatic SQL injection and database takeover tool,Python,37784,6307,37784,51,96096,master,2012-06-26T09:52:15Z,2026-07-02T14:28:29Z,Other,"api-security, appsec, database, database-security, dbms, detection, exploitation, pentesting, python, security-testing, security-testing-tool, sql-injection, sqlinjection, webapp-security, webappsec",public,True,True,True,True,False,False
zoxide,ajeetdsouza/zoxide,ajeetdsouza,A smarter cd command. Supports all major shells.,Rust,37761,836,37761,141,4469,main,2020-03-05T13:11:40Z,2026-07-02T14:08:49Z,MIT License,"autojump, bash, cli, command-line, command-line-tool, elvish, fasd, fish, fish-shell, fzf, hacktoberfest, jump, nushell, powershell, rust, shell, xonsh, xontrib, z, zsh",public,True,False,True,False,False,False
aseprite,aseprite/aseprite,aseprite,"Animated sprite editor & pixel art tool (Windows, macOS, Linux)",C++,37758,8253,37758,1966,47620,main,2014-08-19T23:44:50Z,2026-07-02T14:09:16Z,,"animated-sprites, animation, aseprite, c-plus-plus, cpp, draw, gif, graphics, pixel-art, pixel-editor, sprite-editor, sprites, spritesheet, tile-editor, tilemap-editor",public,True,True,False,False,False,False
freecodecamp.cn,FreeCodeCampChina/freecodecamp.cn,FreeCodeCampChina,FCC China open source codebase and curriculum. Learn to code and help nonprofits.,CSS,37724,1418,37724,159,30959,dev,2016-09-30T03:13:43Z,2026-07-01T17:14:31Z,Other,"career, certification, cn-freecodecamp, community, curriculum, d3, education, freecodecamp, javascript, learn-to-code, math, nodejs, nonprofits, react",public,True,True,True,False,False,False
compose,docker/compose,docker,Define and run multi-container applications with Docker,Go,37695,5804,37695,100,28122,main,2013-12-09T11:40:58Z,2026-07-02T14:17:34Z,Apache License 2.0,"docker, docker-compose, go, golang, orchestration",public,True,False,False,False,False,False
agent-browser,vercel-labs/agent-browser,vercel-labs,Browser automation CLI for AI agents,Rust,37695,2417,37695,544,18243,main,2026-01-11T05:38:15Z,2026-07-02T14:01:25Z,Apache License 2.0,,public,True,True,True,False,False,False
v,vlang/v,vlang,"Simple, fast, safe, compiled language for developing maintainable software. Compiles itself in <1s with zero library dependencies. Supports automatic C => V translation. https://vlang.io",V,37684,2253,37684,39,114748,master,2019-02-08T02:57:06Z,2026-07-02T12:49:51Z,MIT License,"compiler, language, programming-language, v",public,True,True,True,False,False,False
wtfjs,denysdovhan/wtfjs,denysdovhan,🤪 A list of funny and tricky JavaScript examples,JavaScript,37630,2691,37630,45,1501,master,2017-07-14T15:42:12Z,2026-07-02T12:25:21Z,Do What The F*ck You Want To Public License,"book, handbook, javascript, js, learning, notes, specification, wtf",public,True,False,False,False,False,False
taro,NervJS/taro,NervJS,开放式跨端跨框架解决方案，支持使用 React/Vue 等框架来开发微信/京东/百度/支付宝/字节跳动/ QQ 小程序/H5/React Native 等应用。  https://taro.zone/,TypeScript,37574,4889,37574,1738,1593896,main,2018-04-08T09:32:26Z,2026-07-02T05:44:25Z,Other,"javascript, jquery, nerv, nervjs, react, react-native, reactjs, taro, typescript, vue, vue3, wechat, wechat-mini-program, weixin, wxapp",public,True,True,True,True,False,False
UI-TARS-desktop,bytedance/UI-TARS-desktop,bytedance,The Open-Source Multimodal AI Agent Stack: Connecting Cutting-Edge AI Models and Agent Infra,TypeScript,37528,3784,37528,404,192844,main,2025-01-19T09:04:43Z,2026-07-02T14:22:15Z,Apache License 2.0,"agent, agent-tars, browser-use, computer-use, cowork, gui-agent, gui-operator, mcp, mcp-server, multimodal, tars, ui-tars, vision, vlm",public,True,True,False,True,False,False
GFPGAN,TencentARC/GFPGAN,TencentARC,GFPGAN aims at developing Practical Algorithms for Real-world Face Restoration.,Python,37496,6277,37496,404,5467,master,2021-03-19T06:18:20Z,2026-07-02T11:31:11Z,Other,"deep-learning, face-restoration, gan, gfpgan, image-restoration, pytorch, super-resolution",public,True,True,True,False,False,False
tiptap,ueberdosis/tiptap,ueberdosis,The headless rich text editor framework for web artisans.,TypeScript,37484,3043,37484,889,82970,main,2018-08-20T19:58:58Z,2026-07-02T14:22:16Z,MIT License,"editor, javascript, js, prosemirror, react, renderless-components, rich-text, tiptap, vue, wysiwyg, wysiwyg-editor",public,True,True,False,False,False,False
umami,umami-software/umami,umami-software,"Umami is a modern, privacy-focused analytics platform. An open-source alternative to Google Analytics, Mixpanel and Amplitude.",TypeScript,37440,7424,37440,128,29126,master,2020-07-17T07:59:00Z,2026-07-02T12:42:12Z,MIT License,"analytics, audience-segmentation, charts, cohort-analysis, google-analytics, product-analytics, statistics, user-journey, web-analytics",public,True,True,True,False,False,False
agents,wshobson/agents,wshobson,"Multi-harness agentic plugin marketplace for Claude Code, Codex CLI, Cursor, OpenCode, GitHub Copilot, and Gemini CLI",Python,37439,4020,37439,6,5508,main,2025-07-24T23:28:14Z,2026-07-02T13:59:03Z,MIT License,"agent-skills, agentic-ai, agents, ai-agents, anthropic, automation, claude-code, claude-code-plugins, codex-cli, copilot, cursor, cursor-rules, developer-tools, gemini-cli, mcp, multi-agent, opencode, orchestration, prompt-engineering, workflows",public,True,True,True,False,False,False
xyflow,xyflow/xyflow,xyflow,React Flow | Svelte Flow - Powerful open source libraries for building node-based UIs with React (https://reactflow.dev) or Svelte (https://svelteflow.dev). Ready out-of-the-box and infinitely customizable.,TypeScript,37410,2459,37410,123,44803,main,2019-07-15T14:47:30Z,2026-07-02T14:22:49Z,MIT License,"flowchart, graph, javascript, node-based-ui, react, react-flow, svelte, svelte-flow, typescript, typescript-library, workflow",public,True,True,False,False,False,False
arthas,alibaba/arthas,alibaba,Alibaba Java Diagnostic Tool Arthas/Alibaba Java诊断利器Arthas,Java,37408,7632,37408,481,72195,master,2018-08-29T17:15:57Z,2026-07-02T08:00:58Z,Apache License 2.0,"agent, alibaba, arthas, classloader, diagnosis, java, jvm, trace, trouble-shooting",public,True,True,True,True,False,False
LLM101n,karpathy/LLM101n,karpathy,LLM101n: Let's build a Storyteller,,37405,2053,37405,19,275,master,2024-05-27T00:23:38Z,2026-07-02T06:04:55Z,,,public,False,False,False,False,True,False
