repository_name,full_name,owner,description,language,stars,forks,watchers,open_issues,size_kb,default_branch,created_at,updated_at,license,topics,visibility,has_issues,has_projects,has_wiki,has_pages,archived,disabled
htmx,bigskysoftware/htmx,bigskysoftware,</> htmx - high power tools for HTML,JavaScript,48323,1607,48323,660,136140,master,2020-04-13T16:17:51Z,2026-07-02T13:31:55Z,Other,"hateoas, html, htmx, hyperscript, javascript, rest",public,True,False,False,False,False,False
type-challenges,type-challenges/type-challenges,type-challenges,Collection of TypeScript type challenges with online judge,TypeScript,48283,5276,48283,33226,3344,main,2020-07-23T14:33:11Z,2026-07-02T12:25:43Z,MIT License,"challenges, type, type-system, typescript",public,True,True,False,False,False,False
RxJava,ReactiveX/RxJava,ReactiveX,RxJava – Reactive Extensions for the JVM – a library for composing asynchronous and event-based programs using observable sequences for the Java VM.,Java,48233,7586,48233,13,173551,4.x,2013-01-08T20:11:48Z,2026-07-02T03:52:38Z,Apache License 2.0,"flow, java, reactive-streams, rxjava",public,True,True,True,True,False,False
cherry-studio,CherryHQ/cherry-studio,CherryHQ,"AI productivity studio with smart chat, autonomous agents, and 300+ assistants. Unified access to frontier LLMs",TypeScript,48063,4566,48063,1243,300536,main,2024-05-24T01:56:26Z,2026-07-02T14:25:10Z,GNU Affero General Public License v3.0,"agent-skills, ai-agent, awesome-skills, claude-code, codex, deepseek, hermes-agent, openclaw, skills, vibe-coding",public,True,True,False,False,False,False
awesome-design-patterns,DovAmir/awesome-design-patterns,DovAmir,A curated list of software and architecture related design patterns.,,48018,3276,48018,25,98,master,2018-06-04T17:47:48Z,2026-07-02T14:00:04Z,,"architecture, awesome, awesome-list, cloud-computing, design-patterns, gof-patterns, lists, microservices, resources",public,True,True,True,True,False,False
metabase,metabase/metabase,metabase,The easy-to-use open source Business Intelligence and Embedded Analytics tool that lets everyone work with data :bar_chart:,Clojure,48018,6631,48018,4015,2055579,master,2015-02-02T19:25:47Z,2026-07-02T14:26:18Z,Other,"analytics, bi, business-intelligence, businessintelligence, clojure, dashboard, data, data-analysis, data-visualization, database, metabase, mysql, postgres, postgresql, reporting, slack, sql-editor, visualization",public,True,False,False,False,False,False
design-patterns-for-humans,nilbuild/design-patterns-for-humans,nilbuild,An ultra-simplified explanation to design patterns,,47987,5507,47987,16,149,master,2017-02-16T21:24:39Z,2026-07-02T13:48:00Z,,"architecture, computer-science, design-patterns, engineering, principles, software-engineering",public,True,True,True,False,False,False
moment,moment/moment,moment,"Parse, validate, manipulate, and display dates in javascript.",JavaScript,47957,6995,47957,304,22191,develop,2011-03-01T02:46:06Z,2026-07-01T11:57:34Z,MIT License,,public,True,True,False,False,False,False
awesome-react-components,brillout/awesome-react-components,brillout,Curated List of React Components & Libraries.,,47888,3792,47888,56,1367,master,2016-06-24T15:19:33Z,2026-07-02T12:25:11Z,Creative Commons Zero v1.0 Universal,"awesome, awesome-list, react, react-component, react-components",public,True,True,True,False,False,False
system_prompts_leaks,asgeirtj/system_prompts_leaks,asgeirtj,"Extracted system prompts from Anthropic - Claude Fable 5, Opus 4.8, Claude Code, Claude Design. OpenAI - ChatGPT 5.5 Thinking, GPT 5.5 Instant, Codex. Google - Gemini 3.5 Flash, 3.1 Pro, Antigravity. xAI - Grok, Cursor, Copilot, VS Code, Perplexity, and more. Updated regularly.",JavaScript,47792,7789,47792,27,7040,main,2025-05-03T02:43:56Z,2026-07-02T14:28:04Z,Creative Commons Zero v1.0 Universal,"ai, ai-agents, anthropic, awesome, chatbot, chatgpt, claude, claude-code, codex, deep-learning, education, gemini, generative-ai, google, llm, machine-learning, nlp, open-source, openai, prompt-engineering",public,True,False,True,True,False,False
awesome-claude-code,hesreallyhim/awesome-claude-code,hesreallyhim,"A curated list of awesome skills, hooks, slash-commands, agent orchestrators, applications, and plugins for Claude Code by Anthropic",Python,47787,4185,47787,585,31990,main,2025-04-19T20:55:59Z,2026-07-02T14:02:50Z,Other,"agent-skills, agentic-code, agentic-coding, ai-workflow-optimization, ai-workflows, anthropic, anthropic-claude, awesome, awesome-claude-code, awesome-list, awesome-lists, awesome-resources, claude, claude-code, coding-agent, coding-agents, coding-assistant, coding-assistants, llm",public,True,False,False,False,False,False
Projects,karan/Projects,karan,:page_with_curl: A list of practical projects that anyone can solve in any programming language.,,47775,10627,47775,123,1790,master,2013-07-04T13:37:27Z,2026-07-02T13:57:59Z,MIT License,,public,True,True,False,False,False,False
big-list-of-naughty-strings,minimaxir/big-list-of-naughty-strings,minimaxir,The Big List of Naughty Strings is a list of strings which have a high probability of causing issues when used as user-input data.,Python,47691,2158,47691,108,330,master,2015-08-08T20:57:20Z,2026-07-02T12:13:01Z,MIT License,,public,True,True,True,False,False,False
pixijs,pixijs/pixijs,pixijs,"The HTML5 Creation Engine: Create beautiful digital content with the fastest, most flexible 2D WebGL renderer.",TypeScript,47658,5037,47658,353,136816,dev,2013-01-21T22:40:50Z,2026-07-02T10:18:33Z,MIT License,"canvas, canvas2d, data-visualization, game, glsl, javascript, pixi, pixijs, renderer, rendering, rendering-2d-graphics, rendering-engine, webgl",public,True,True,True,False,False,False
gogs,gogs/gogs,gogs,The painless way to host your own Git service,Go,47643,5074,47643,999,212291,main,2014-02-12T01:57:08Z,2026-07-02T04:05:35Z,MIT License,"docker, git, go, gogs, mysql, postgresql, raspberry-pi, self-hosted, source-code-management, sqlite3, version-control",public,True,False,False,False,False,False
slidev,slidevjs/slidev,slidevjs,Presentation Slides for Developers,TypeScript,47481,2111,47481,212,81082,main,2021-04-24T01:25:23Z,2026-07-02T14:25:05Z,MIT License,"markdown, presentation, slides, vite, vue, vueuse",public,True,False,False,False,False,False
textgen,oobabooga/textgen,oobabooga,"Open-source desktop app for local LLMs. Text, vision, tool-calling, OpenAI/Anthropic-compatible API. 100% private.",Python,47396,5980,47396,822,32059,main,2022-12-21T04:17:37Z,2026-07-02T12:58:25Z,GNU Affero General Public License v3.0,,public,True,True,True,False,False,False
discourse,discourse/discourse,discourse,"A platform for community discussion. Free, open, simple.",Ruby,47380,8946,47380,198,929073,main,2013-01-12T00:25:55Z,2026-07-02T13:25:43Z,GNU General Public License v2.0,"discourse, ember, forum, javascript, postgresql, rails, ruby",public,False,False,False,False,False,False
LocalAI,mudler/LocalAI,mudler,"LocalAI is the open-source AI engine. Run any model - LLMs, vision, voice, image, video - on any hardware. No GPU required.",Go,47274,4187,47274,204,77357,master,2023-03-18T22:58:02Z,2026-07-02T14:12:32Z,MIT License,"agents, ai, api, audio-generation, decentralized, distributed, image-generation, libp2p, llama, llm, mamba, mcp, musicgen, object-detection, rerank, stable-diffusion, text-generation, tts",public,True,True,True,True,False,False
tmux,tmux/tmux,tmux,tmux source code,C,47270,2729,47270,30,20801,master,2015-06-03T23:32:55Z,2026-07-02T14:09:40Z,ISC License,,public,True,False,True,False,False,False
spotube,KRTirtho/spotube,KRTirtho,🎧 Open source music streaming app! Available for both desktop & mobile!,Dart,47269,2180,47269,815,146378,master,2021-02-14T03:17:58Z,2026-07-02T14:30:40Z,Other,"android, android-client, android-music-player, desktop-client, fdroid, flutter, flutter-desktop, linux, macos, music, music-player, windows, youtube",public,True,True,True,True,False,False
quill,slab/quill,slab,Quill is a modern WYSIWYG editor built for compatibility and extensibility,TypeScript,47218,3659,47218,651,18429,main,2012-07-30T23:23:18Z,2026-07-02T09:13:57Z,"BSD 3-Clause ""New"" or ""Revised"" License","editor, quill, rich-text-editor, wysiwyg",public,True,False,False,False,False,False
frontend-dev-bookmarks,dypsilon/frontend-dev-bookmarks,dypsilon,Manually curated collection of resources for frontend web developers.,,47110,5148,47110,132,1048,master,2013-06-22T13:23:55Z,2026-07-02T12:24:49Z,,"awesome, awesome-list, frontend, list",public,True,True,False,False,False,False
react,typescript-cheatsheets/react,typescript-cheatsheets,Cheatsheets for experienced React developers getting started with TypeScript,TypeScript,47089,4294,47089,0,3105,main,2018-06-02T04:08:16Z,2026-07-02T08:39:01Z,MIT License,"cheatsheet, guide, react, typescript",public,True,False,False,False,False,False
acme.sh,acmesh-official/acme.sh,acmesh-official,A pure Unix shell script ACME client for SSL / TLS certificate automation,Shell,47046,5625,47046,1412,7364,master,2015-12-26T12:56:33Z,2026-07-02T14:13:08Z,GNU General Public License v3.0,"acme, acme-challenge, acme-protocol, acme-v2, ash, bash, buypass, certbot, lets-encrypt, posix, posix-sh, shell, ssl, ssl-certificate, ssl-certificates, tls, tls-certificate, zerossl",public,True,False,True,False,False,False
okhttp,square/okhttp,square,"Square’s meticulous HTTP client for the JVM, Android, and GraalVM.",Kotlin,46994,9269,46994,119,66940,master,2012-07-23T13:42:55Z,2026-07-02T08:41:27Z,Apache License 2.0,"android, graalvm, java, kotlin",public,True,False,False,True,False,False
bevy,bevyengine/bevy,bevyengine,A refreshingly simple data-driven game engine built in Rust,Rust,46974,4667,46974,3320,169523,main,2020-01-18T21:13:55Z,2026-07-02T13:07:15Z,Apache License 2.0,"bevy, game-development, game-engine, gamedev, open-source, rust",public,True,True,False,True,False,False
nvm-windows,coreybutler/nvm-windows,coreybutler,A node.js version management utility for Windows. Ironically written in Go.,Go,46966,3841,46966,87,32685,master,2014-09-20T16:37:28Z,2026-07-02T09:24:39Z,MIT License,"go, management, node, node-version-manager, nodejs, nvm, switch, version, version-manager, versioning, windows",public,True,True,True,False,False,False
GitHubDaily,GitHubDaily/GitHubDaily,GitHubDaily,"坚持分享 GitHub 上高质量、有趣实用的开源技术教程、开发者工具、编程网站、技术资讯。A list cool, interesting projects of GitHub.",,46953,4648,46953,664,3027,master,2018-12-30T13:56:58Z,2026-07-02T14:13:38Z,,"ai, algorithms-and-data-structures, backend, developer-tools, development, frontend, github, java, javascript, kubernetes, linux, markdown, open-source, python, tutorials, web",public,True,True,True,False,False,False
aider,Aider-AI/aider,Aider-AI,aider is AI pair programming in your terminal,Python,46950,4680,46950,1698,140356,main,2023-05-09T18:57:49Z,2026-07-02T14:09:28Z,Apache License 2.0,"anthropic, chatgpt, claude-3, cli, command-line, gemini, gpt-3, gpt-35-turbo, gpt-4, gpt-4o, llama, openai, sonnet",public,True,True,True,True,False,False
JeecgBoot,jeecgboot/JeecgBoot,jeecgboot,AI 低代码平台「低代码 + 零代码」双驱动！低代码可一键生成前后端代码;零代码可 5 分钟搭建系统;AI Skills 一句话画流程、设计表单、生成整套系统。内置 AI聊天、知识库、流程编排、MCP插件等，兼容主流大模型。引领「AI 生成 → 在线配置 → 代码生成 → 手工合并->AI修改」开发模式，消除 Java 项目 80% 的重复工作，提效而不失灵活。,Java,46927,16079,46927,39,96093,main,2018-11-26T10:40:00Z,2026-07-02T11:52:12Z,Apache License 2.0,"activiti, agent, ai, antd, claude-code, cli, codegenerator, codex, flowable, langchain4j, llm, low-code, mcp, mybatis-plus, rag, skills, spring-ai, springboot, springcloud, vue3",public,True,True,True,True,False,False
serverless,serverless/serverless,serverless,"⚡ Serverless Framework – Effortlessly build apps that auto-scale, incur zero costs when idle, and require minimal maintenance using AWS Lambda and other managed cloud services.",JavaScript,46910,5729,46910,1223,112209,main,2015-04-21T03:48:40Z,2026-07-02T12:07:29Z,Other,"aws, aws-dynamodb, aws-lambda, azure-functions, google-cloud-functions, microservice, serverless, serverless-architectures, serverless-framework",public,True,False,False,False,False,False
v2ray-core,v2ray/v2ray-core,v2ray,A platform for building proxies to bypass network restrictions.,Go,46899,8844,46899,16,55242,master,2015-09-04T11:42:53Z,2026-07-02T08:03:25Z,MIT License,"golang, http-proxy, proxy, shadowsocks, socks, socks5, v2ray, vmess",public,True,False,False,False,False,False
legado,gedoor/legado,gedoor,"Legado 3.0 Book Reader with powerful controls & full functions❤️阅读3.0, 阅读是一款可以自定义来源阅读网络内容的工具，为广大网络文学爱好者提供一种方便、快捷舒适的试读体验。",Kotlin,46866,5864,46866,18,52,main,2019-05-22T04:18:58Z,2026-07-02T13:35:35Z,,,public,False,False,False,False,False,False
upscayl,upscayl/upscayl,upscayl,"🆙 Upscayl - #1 Free and Open Source AI Image Upscaler for Linux, MacOS and Windows.",TypeScript,46583,2302,46583,55,567883,main,2022-07-30T17:19:20Z,2026-07-02T13:58:17Z,GNU Affero General Public License v3.0,"ai, electron, esrgan, gigapixel, gigapixel-images, image, image-upscaling, topaz, upscale, upscalerimage, upscayl",public,True,False,True,False,False,False
awesome-remote-job,lukasz-madon/awesome-remote-job,lukasz-madon,A curated list of awesome remote jobs and resources. Inspired by https://github.com/vinta/awesome-python,,46572,4657,46572,47,1119,master,2015-01-02T00:31:34Z,2026-07-02T14:19:27Z,,"awesome, awesome-list, list",public,True,True,True,False,False,False
30-Days-Of-JavaScript,Asabeneh/30-Days-Of-JavaScript,Asabeneh,"30 days of JavaScript programming challenge is a step-by-step guide to learn JavaScript programming language in 30 days. This challenge may take more than 100 days,  please just follow your own pace. These videos may help too: https://www.youtube.com/channel/UC7PNRuno1rzYPb1xLa4yktw",JavaScript,46522,10459,46522,367,124993,master,2019-12-23T14:07:40Z,2026-07-02T14:22:40Z,,"30daysofjavascript, angular, challenge, css, d3, d3js, html, javascript, javascript-for-everyone, js, json, node, nodejs, programming, react, redux, typescript, vue, webdevelopment, website",public,True,True,True,False,False,False
prisma,prisma/prisma,prisma,"Next-generation ORM for Node.js & TypeScript | PostgreSQL, MySQL, MariaDB, SQL Server, SQLite, MongoDB and CockroachDB",TypeScript,46326,2258,46326,2637,178087,main,2019-06-20T13:33:47Z,2026-07-02T14:26:26Z,Apache License 2.0,"cockroachdb, database, javascript, mariadb, mongo, mongodb, mongodb-orm, mssql, mysql, nodejs, orm, postgres, postgresql, prisma, prisma-client, query-builder, sql-server, sqlite, sqlserver, typescript",public,True,True,False,True,False,False
claude-cookbooks,anthropics/claude-cookbooks,anthropics,A collection of notebooks/recipes showcasing some fun and effective ways of using Claude.,Jupyter Notebook,46282,5465,46282,267,207478,main,2023-08-15T20:23:51Z,2026-07-02T14:29:45Z,MIT License,,public,True,True,True,False,False,False
monaco-editor,microsoft/monaco-editor,microsoft,A browser based code editor,JavaScript,46281,4087,46281,830,139570,main,2016-06-07T16:56:31Z,2026-07-02T11:25:12Z,MIT License,"browser, editor, monaco-editor, typescript, vscode",public,True,False,True,True,False,False
supervision,roboflow/supervision,roboflow,We write your reusable computer vision tools. 💜,Python,46241,4104,46241,97,3573975,develop,2022-11-28T14:08:44Z,2026-07-02T14:26:15Z,MIT License,"classification, coco, computer-vision, deep-learning, hacktoberfest, image-processing, instance-segmentation, low-code, machine-learning, metrics, object-detection, oriented-bounding-box, pascal-voc, python, pytorch, tensorflow, tracking, video-processing, yolo",public,True,True,False,True,False,False
awesome-cheatsheets,LeCoupa/awesome-cheatsheets,LeCoupa,"👩‍💻👨‍💻 Awesome cheatsheets for popular programming languages, frameworks and development tools. They include everything you should know in one single file.",JavaScript,46130,6706,46130,137,8889,master,2017-11-09T02:47:15Z,2026-07-02T13:55:14Z,MIT License,"backend, bash, cheatsheet, cheatsheets, database, django, docker, feathersjs, frontend, javascript, kubernetes, language, nodejs, php, programming-language, redis, sailsjs, vim, vuejs, xcode",public,True,True,True,True,False,False
learn-regex,ziishaned/learn-regex,ziishaned,Learn regex the easy way,,46084,6156,46084,65,928,master,2017-07-22T12:21:03Z,2026-07-02T05:04:22Z,MIT License,"learn-regex, regex, regular-expression",public,True,True,True,False,False,False
cal.diy,calcom/cal.diy,calcom,Scheduling infrastructure for absolutely everyone.,TypeScript,46016,14305,46016,1322,1144557,main,2021-03-22T13:47:42Z,2026-07-02T14:00:50Z,MIT License,"next-auth, nextjs, open-source, postgresql, prisma, t3-stack, tailwindcss, trpc, turborepo, typescript, zod",public,True,False,False,False,False,False
airflow,apache/airflow,apache,"Apache Airflow - A platform to programmatically author, schedule, and monitor workflows",Python,45999,17329,45999,1694,651643,main,2015-04-13T18:04:58Z,2026-07-02T14:30:37Z,Apache License 2.0,"airflow, apache, apache-airflow, automation, dag, data-engineering, data-integration, data-orchestrator, data-pipelines, data-science, elt, etl, machine-learning, mlops, orchestration, python, scheduler, workflow, workflow-engine, workflow-orchestration",public,True,True,False,False,False,False
exo,exo-explore/exo,exo-explore,Run frontier AI locally.,Python,45830,3300,45830,281,40784,main,2024-06-24T18:36:22Z,2026-07-02T14:08:47Z,Apache License 2.0,,public,True,True,False,False,False,False
container,apple/container,apple,"A tool for creating and running Linux containers using lightweight virtual machines on a Mac. It is written in Swift, and optimized for Apple silicon. ",Swift,45812,1363,45812,400,3764,main,2025-05-30T21:26:05Z,2026-07-02T14:10:35Z,Apache License 2.0,,public,True,True,False,True,False,False
Umi-OCR,hiroi-sora/Umi-OCR,hiroi-sora,"OCR software, free and offline. 开源、免费的离线OCR软件。支持截屏/批量导入图片，PDF文档识别，排除水印/页眉页脚，扫描/生成二维码。内置多国语言库。",Python,45746,4500,45746,352,281373,main,2022-03-28T04:01:46Z,2026-07-02T14:30:46Z,MIT License,"ocr, ocr-python, paddleocr, qml, qt, screenshot, umi-ocr",public,True,True,True,False,False,False
CowAgent,zhayujie/CowAgent,zhayujie,"Open-source super AI assistant & Agent Harness. Plans tasks, runs tools and skills, self-evolves with memory and knowledge. Multi-model, multi-channel. Lightweight, extensible, one-line install. (formerly chatgpt-on-wechat)",Python,45746,10250,45746,22,10935,master,2022-08-07T08:33:41Z,2026-07-02T14:09:20Z,MIT License,"ai, ai-agent, ai-agents, chatgpt-on-wechat, claude, claude-code, codex, cowagent, deepseek, harness, llm, mcp, multi-agent, openai, openclaw, skills",public,True,True,True,False,False,False
Rocket.Chat,RocketChat/Rocket.Chat,RocketChat,The Secure CommsOS™ for mission-critical operations,TypeScript,45744,13693,45744,3820,2054511,develop,2015-05-19T07:36:09Z,2026-07-02T13:31:05Z,Other,"chat, collaboration, foss, free, hacktoberfest, javascript, meteor, mit, real-time, slack, webrtc",public,True,True,True,True,False,False
architecture-samples,android/architecture-samples,android,A collection of samples to discuss and showcase different architectural tools and patterns for Android apps.,Kotlin,45737,11861,45737,221,13365,main,2016-02-05T13:42:07Z,2026-07-02T14:10:45Z,Apache License 2.0,"android, android-architecture, samples",public,True,True,True,False,False,False
awesome-compose,docker/awesome-compose,docker,Awesome Docker Compose samples,HTML,45728,8225,45728,395,11061,master,2020-02-13T08:51:42Z,2026-07-02T14:17:41Z,Creative Commons Zero v1.0 Universal,"awesome, awesome-list, docker-compose",public,True,False,False,False,False,False
TTS,coqui-ai/TTS,coqui-ai,"🐸💬 - a deep learning toolkit for Text-to-Speech, battle-tested in research and production",Python,45672,6135,45672,8,170196,dev,2020-05-20T15:45:28Z,2026-07-02T11:44:06Z,Mozilla Public License 2.0,"deep-learning, glow-tts, hifigan, melgan, multi-speaker-tts, python, pytorch, speaker-encoder, speaker-encodings, speech, speech-synthesis, tacotron, text-to-speech, tts, tts-model, vocoder, voice-cloning, voice-conversion, voice-synthesis",public,True,True,True,False,False,False
zx,google/zx,google,A tool for writing better scripts,JavaScript,45582,1272,45582,51,3960,main,2021-05-05T05:50:01Z,2026-07-02T12:25:53Z,Apache License 2.0,"bash, child-process, cli, exec, javascript, nodejs, pipe, shell, spawn",public,True,True,False,True,False,False
qlib,microsoft/qlib,microsoft,"Qlib is an AI-oriented Quant investment platform that aims to use AI tech to empower Quant Research, from exploring ideas to implementing productions. Qlib supports diverse ML modeling paradigms, including supervised learning, market dynamics modeling, and RL, and is now equipped with https://github.com/microsoft/RD-Agent to automate R&D process.",Python,45521,7243,45521,451,17997,main,2020-08-14T06:46:00Z,2026-07-02T13:26:26Z,MIT License,"algorithmic-trading, auto-quant, deep-learning, finance, fintech, investment, machine-learning, paper, platform, python, quant, quant-dataset, quant-models, quantitative-finance, quantitative-trading, research, research-paper, stock-data",public,True,True,True,False,False,False
AdminLTE,ColorlibHQ/AdminLTE,ColorlibHQ,AdminLTE - Free admin dashboard template based on Bootstrap 5,Astro,45483,18198,45483,0,142980,master,2013-12-25T02:52:40Z,2026-07-02T14:00:38Z,MIT License,"admin, admin-dashboard, admin-dashboard-template, admin-dashboard-ui, admin-panel, admin-template, admin-ui, adminlte, astro-template, bootstrap, bootstrap-admin-panel, bootstrap5, css, dark-mode, dashboard, dashboard-template, dashboards, html, responsive, vanilla-js",public,True,True,False,True,False,False
copyparty,9001/copyparty,9001,"Portable file server with accelerated resumable uploads, dedup, WebDAV, SFTP, FTP, TFTP, zeroconf, media indexer, thumbnails++ all in one file",Python,45453,1852,45453,270,9748,hovudstraum,2019-05-26T15:28:33Z,2026-07-02T13:19:30Z,MIT License,"copyparty, file-server, file-sharing, file-upload-server, ftp-server, nas-frontend, tftp-server, webdav-server",public,True,False,False,False,False,False
jest,jestjs/jest,jestjs,Delightful JavaScript Testing.,TypeScript,45424,6659,45424,227,319892,main,2013-12-10T00:18:04Z,2026-07-02T13:56:42Z,MIT License,"easy, expectation, facebook, immersive, javascript, painless, painless-javascript-testing, snapshot, testing",public,True,True,True,True,False,False
iina,iina/iina,iina,The modern video player for macOS.,Swift,45414,2849,45414,1877,249005,develop,2016-12-19T07:18:45Z,2026-07-02T13:41:22Z,GNU General Public License v3.0,"hacktoberfest, macos, mpv, swift, video, video-player",public,True,False,True,False,False,False
shannon,KeygraphHQ/shannon,KeygraphHQ,"Shannon is an autonomous, white-box AI pentester for web applications and APIs. It analyzes your source code, identifies attack vectors, and executes real exploits to prove vulnerabilities before they reach production.",TypeScript,45356,5257,45356,23,62830,main,2025-09-27T01:51:47Z,2026-07-02T14:02:21Z,GNU Affero General Public License v3.0,"penetration-testing, pentesting, security-audit, security-automation, security-tools",public,True,True,True,False,False,False
bruno,usebruno/bruno,usebruno,Opensource IDE For Exploring and Testing API's (lightweight alternative to Postman/Insomnia),JavaScript,45298,2627,45298,1753,53511,main,2022-09-27T20:51:45Z,2026-07-02T13:50:01Z,MIT License,"api-client, api-testing, automation, developer-tools, git, graphql-client, http-client, javascript, openapi, openapi3, opensource, rest-api, testing, testing-tools",public,True,False,False,False,False,False
Leaflet,Leaflet/Leaflet,Leaflet,🍃 JavaScript library for mobile-friendly interactive maps 🇺🇦,JavaScript,45292,6138,45292,543,59761,main,2010-09-22T16:57:44Z,2026-07-02T14:20:04Z,"BSD 2-Clause ""Simplified"" License","javascript, leaflet, maps",public,True,True,False,True,False,False
pandoc,jgm/pandoc,jgm,Universal markup converter,Haskell,45180,3910,45180,1062,70434,main,2010-03-20T20:34:23Z,2026-07-02T13:44:12Z,GNU General Public License v2.0,"commonmark, converter, document, haskell, markdown, markup, pandoc, presentation, publishing",public,True,True,True,False,False,False
Summer2026-Internships,SimplifyJobs/Summer2026-Internships,SimplifyJobs,"Summer 2026 software engineering, data science, AI, quant, product management, and hardware internship postings. Updated daily by Simplify and Pitt CSC.",Python,45170,3186,45170,35,2844452,dev,2020-05-23T20:53:18Z,2026-07-02T14:03:57Z,,"data-science, fall-2026, github, internship, internships, interview-preparation, jobs, software-engineering, university",public,True,False,False,False,False,False
CppCoreGuidelines,isocpp/CppCoreGuidelines,isocpp,"The C++ Core Guidelines are a set of tried-and-true guidelines, rules, and best practices about coding in C++",CSS,45147,5552,45147,250,27700,master,2015-08-19T20:22:52Z,2026-07-02T09:01:07Z,Other,,public,True,True,False,True,False,False
streamlit,streamlit/streamlit,streamlit,Streamlit — A faster way to build and share data apps.,Python,45123,4304,45123,1279,1038262,develop,2019-08-24T00:14:52Z,2026-07-02T13:17:51Z,Apache License 2.0,"data-analysis, data-science, data-visualization, deep-learning, developer-tools, machine-learning, python, streamlit",public,True,False,False,False,False,False
